2025-04-20 15:48:59,957 - INFO - Starting argument generation. Log file: logs/arg_generation_20250420_154859.log
2025-04-20 15:48:59,957 - INFO - Parameters: total_premises=10000, batch_size=100, restart_interval=1000
2025-04-20 19:24:55,619 - INFO - 
=== Progress Update ===
2025-04-20 19:24:55,620 - INFO - Processed premises: 1000/10000
2025-04-20 19:24:55,620 - INFO - Total elapsed time: 12955.66 seconds
2025-04-20 19:24:55,620 - INFO - Time since last save: 12955.66 seconds
2025-04-20 19:24:55,620 - INFO - Valid arguments found: 1641
2025-04-20 19:24:55,620 - INFO - Invalid arguments found: 20380
2025-04-20 19:24:55,620 - INFO - Average time per premise: 12.96 seconds
2025-04-20 19:24:55,620 - INFO - 
Difficulty Distribution:
2025-04-20 19:24:55,620 - INFO - Difficulty 14-15: 1 arguments
2025-04-20 19:24:55,620 - INFO - Difficulty 15-16: 3 arguments
2025-04-20 19:24:55,620 - INFO - Difficulty 16-17: 5 arguments
2025-04-20 19:24:55,621 - INFO - Difficulty 17-18: 7 arguments
2025-04-20 19:24:55,621 - INFO - Difficulty 18-19: 21 arguments
2025-04-20 19:24:55,621 - INFO - Difficulty 19-20: 14 arguments
2025-04-20 19:24:55,621 - INFO - Difficulty 20-21: 29 arguments
2025-04-20 19:24:55,621 - INFO - Difficulty 21-22: 40 arguments
2025-04-20 19:24:55,621 - INFO - Difficulty 22-23: 21 arguments
2025-04-20 19:24:55,621 - INFO - Difficulty 23-24: 30 arguments
2025-04-20 19:24:55,621 - INFO - Difficulty 24-25: 33 arguments
2025-04-20 19:24:55,621 - INFO - Difficulty 25-26: 45 arguments
2025-04-20 19:24:55,621 - INFO - Difficulty 26-27: 34 arguments
2025-04-20 19:24:55,621 - INFO - Difficulty 27-28: 41 arguments
2025-04-20 19:24:55,621 - INFO - Difficulty 28-29: 19 arguments
2025-04-20 19:24:55,621 - INFO - Difficulty 29-30: 20 arguments
2025-04-20 19:24:55,621 - INFO - Difficulty 30-31: 20 arguments
2025-04-20 19:24:55,621 - INFO - Difficulty 31-32: 19 arguments
2025-04-20 19:24:55,621 - INFO - Difficulty 32-33: 18 arguments
2025-04-20 19:24:55,621 - INFO - Difficulty 33-34: 19 arguments
2025-04-20 19:24:55,621 - INFO - Difficulty 34-35: 18 arguments
2025-04-20 19:24:55,622 - INFO - Difficulty 35-36: 15 arguments
2025-04-20 19:24:55,622 - INFO - Difficulty 36-37: 19 arguments
2025-04-20 19:24:55,622 - INFO - Difficulty 37-38: 19 arguments
2025-04-20 19:24:55,622 - INFO - Difficulty 38-39: 14 arguments
2025-04-20 19:24:55,622 - INFO - Difficulty 39-40: 15 arguments
2025-04-20 19:24:55,622 - INFO - Difficulty 40-41: 24 arguments
2025-04-20 19:24:55,622 - INFO - Difficulty 41-42: 14 arguments
2025-04-20 19:24:55,622 - INFO - Difficulty 42-43: 17 arguments
2025-04-20 19:24:55,622 - INFO - Difficulty 43-44: 16 arguments
2025-04-20 19:24:55,622 - INFO - Difficulty 44-45: 15 arguments
2025-04-20 19:24:55,622 - INFO - Difficulty 45-46: 18 arguments
2025-04-20 19:24:55,622 - INFO - Difficulty 46-47: 18 arguments
2025-04-20 19:24:55,622 - INFO - Difficulty 47-48: 14 arguments
2025-04-20 19:24:55,622 - INFO - Difficulty 48-49: 12 arguments
2025-04-20 19:24:55,622 - INFO - Difficulty 49-50: 10 arguments
2025-04-20 19:24:55,622 - INFO - Difficulty 50-51: 16 arguments
2025-04-20 19:24:55,622 - INFO - Difficulty 51-52: 10 arguments
2025-04-20 19:24:55,622 - INFO - Difficulty 52-53: 6 arguments
2025-04-20 19:24:55,623 - INFO - Difficulty 53-54: 10 arguments
2025-04-20 19:24:55,623 - INFO - Difficulty 54-55: 9 arguments
2025-04-20 19:24:55,623 - INFO - Difficulty 55-56: 9 arguments
2025-04-20 19:24:55,623 - INFO - Difficulty 56-57: 13 arguments
2025-04-20 19:24:55,623 - INFO - Difficulty 57-58: 9 arguments
2025-04-20 19:24:55,623 - INFO - Difficulty 58-59: 8 arguments
2025-04-20 19:24:55,623 - INFO - Difficulty 59-60: 6 arguments
2025-04-20 19:24:55,623 - INFO - Difficulty 60-61: 13 arguments
2025-04-20 19:24:55,623 - INFO - Difficulty 61-62: 10 arguments
2025-04-20 19:24:55,623 - INFO - Difficulty 62-63: 9 arguments
2025-04-20 19:24:55,623 - INFO - Difficulty 63-64: 5 arguments
2025-04-20 19:24:55,623 - INFO - Difficulty 64-65: 10 arguments
2025-04-20 19:24:55,623 - INFO - Difficulty 65-66: 7 arguments
2025-04-20 19:24:55,623 - INFO - Difficulty 66-67: 10 arguments
2025-04-20 19:24:55,623 - INFO - Difficulty 67-68: 14 arguments
2025-04-20 19:24:55,623 - INFO - Difficulty 68-69: 7 arguments
2025-04-20 19:24:55,623 - INFO - Difficulty 69-70: 15 arguments
2025-04-20 19:24:55,623 - INFO - Difficulty 70-71: 14 arguments
2025-04-20 19:24:55,624 - INFO - Difficulty 71-72: 10 arguments
2025-04-20 19:24:55,624 - INFO - Difficulty 72-73: 10 arguments
2025-04-20 19:24:55,624 - INFO - Difficulty 73-74: 11 arguments
2025-04-20 19:24:55,624 - INFO - Difficulty 74-75: 7 arguments
2025-04-20 19:24:55,624 - INFO - Difficulty 75-76: 13 arguments
2025-04-20 19:24:55,624 - INFO - Difficulty 76-77: 16 arguments
2025-04-20 19:24:55,624 - INFO - Difficulty 77-78: 17 arguments
2025-04-20 19:24:55,624 - INFO - Difficulty 78-79: 5 arguments
2025-04-20 19:24:55,624 - INFO - Difficulty 79-80: 14 arguments
2025-04-20 19:24:55,624 - INFO - Difficulty 80-81: 5 arguments
2025-04-20 19:24:55,624 - INFO - Difficulty 81-82: 9 arguments
2025-04-20 19:24:55,624 - INFO - Difficulty 82-83: 8 arguments
2025-04-20 19:24:55,624 - INFO - Difficulty 83-84: 6 arguments
2025-04-20 19:24:55,624 - INFO - Difficulty 84-85: 9 arguments
2025-04-20 19:24:55,624 - INFO - Difficulty 85-86: 9 arguments
2025-04-20 19:24:55,624 - INFO - Difficulty 86-87: 11 arguments
2025-04-20 19:24:55,624 - INFO - Difficulty 87-88: 5 arguments
2025-04-20 19:24:55,624 - INFO - Difficulty 88-89: 8 arguments
2025-04-20 19:24:55,624 - INFO - Difficulty 89-90: 8 arguments
2025-04-20 19:24:55,625 - INFO - Difficulty 90-91: 3 arguments
2025-04-20 19:24:55,625 - INFO - Difficulty 91-92: 8 arguments
2025-04-20 19:24:55,625 - INFO - Difficulty 92-93: 3 arguments
2025-04-20 19:24:55,625 - INFO - Difficulty 93-94: 5 arguments
2025-04-20 19:24:55,625 - INFO - Difficulty 94-95: 5 arguments
2025-04-20 19:24:55,625 - INFO - Difficulty 95-96: 3 arguments
2025-04-20 19:24:55,625 - INFO - Difficulty 96-97: 1 arguments
2025-04-20 19:24:55,625 - INFO - Difficulty 97-98: 4 arguments
2025-04-20 19:24:55,625 - INFO - Difficulty 98-99: 7 arguments
2025-04-20 19:24:55,625 - INFO - Difficulty 99-100: 3 arguments
2025-04-20 19:24:55,625 - INFO - Difficulty 100-101: 2 arguments
2025-04-20 19:24:55,625 - INFO - Difficulty 101-102: 6 arguments
2025-04-20 19:24:55,625 - INFO - Difficulty 102-103: 8 arguments
2025-04-20 19:24:55,625 - INFO - Difficulty 103-104: 6 arguments
2025-04-20 19:24:55,625 - INFO - Difficulty 104-105: 4 arguments
2025-04-20 19:24:55,625 - INFO - Difficulty 105-106: 3 arguments
2025-04-20 19:24:55,625 - INFO - Difficulty 106-107: 4 arguments
2025-04-20 19:24:55,625 - INFO - Difficulty 107-108: 4 arguments
2025-04-20 19:24:55,625 - INFO - Difficulty 108-109: 7 arguments
2025-04-20 19:24:55,626 - INFO - Difficulty 109-110: 10 arguments
2025-04-20 19:24:55,626 - INFO - Difficulty 110-111: 5 arguments
2025-04-20 19:24:55,626 - INFO - Difficulty 111-112: 2 arguments
2025-04-20 19:24:55,626 - INFO - Difficulty 112-113: 6 arguments
2025-04-20 19:24:55,626 - INFO - Difficulty 113-114: 5 arguments
2025-04-20 19:24:55,626 - INFO - Difficulty 114-115: 2 arguments
2025-04-20 19:24:55,626 - INFO - Difficulty 115-116: 5 arguments
2025-04-20 19:24:55,626 - INFO - Difficulty 116-117: 3 arguments
2025-04-20 19:24:55,626 - INFO - Difficulty 117-118: 4 arguments
2025-04-20 19:24:55,626 - INFO - Difficulty 118-119: 4 arguments
2025-04-20 19:24:55,626 - INFO - Difficulty 119-120: 3 arguments
2025-04-20 19:24:55,626 - INFO - Difficulty 120-121: 5 arguments
2025-04-20 19:24:55,626 - INFO - Difficulty 121-122: 2 arguments
2025-04-20 19:24:55,626 - INFO - Difficulty 122-123: 5 arguments
2025-04-20 19:24:55,626 - INFO - Difficulty 123-124: 4 arguments
2025-04-20 19:24:55,626 - INFO - Difficulty 124-125: 4 arguments
2025-04-20 19:24:55,626 - INFO - Difficulty 125-126: 1 arguments
2025-04-20 19:24:55,626 - INFO - Difficulty 126-127: 1 arguments
2025-04-20 19:24:55,626 - INFO - Difficulty 127-128: 1 arguments
2025-04-20 19:24:55,627 - INFO - Difficulty 128-129: 1 arguments
2025-04-20 19:24:55,627 - INFO - Difficulty 129-130: 2 arguments
2025-04-20 19:24:55,627 - INFO - Difficulty 130-131: 5 arguments
2025-04-20 19:24:55,627 - INFO - Difficulty 131-132: 4 arguments
2025-04-20 19:24:55,627 - INFO - Difficulty 132-133: 5 arguments
2025-04-20 19:24:55,627 - INFO - Difficulty 133-134: 1 arguments
2025-04-20 19:24:55,627 - INFO - Difficulty 135-136: 1 arguments
2025-04-20 19:24:55,627 - INFO - Difficulty 136-137: 2 arguments
2025-04-20 19:24:55,627 - INFO - Difficulty 137-138: 2 arguments
2025-04-20 19:24:55,627 - INFO - Difficulty 138-139: 3 arguments
2025-04-20 19:24:55,627 - INFO - Difficulty 139-140: 2 arguments
2025-04-20 19:24:55,627 - INFO - Difficulty 140-141: 4 arguments
2025-04-20 19:24:55,627 - INFO - Difficulty 141-142: 2 arguments
2025-04-20 19:24:55,627 - INFO - Difficulty 142-143: 2 arguments
2025-04-20 19:24:55,627 - INFO - Difficulty 143-144: 2 arguments
2025-04-20 19:24:55,627 - INFO - Difficulty 144-145: 1 arguments
2025-04-20 19:24:55,627 - INFO - Difficulty 145-146: 3 arguments
2025-04-20 19:24:55,627 - INFO - Difficulty 146-147: 5 arguments
2025-04-20 19:24:55,628 - INFO - Difficulty 147-148: 1 arguments
2025-04-20 19:24:55,628 - INFO - Difficulty 150-151: 4 arguments
2025-04-20 19:24:55,628 - INFO - Difficulty 151-152: 2 arguments
2025-04-20 19:24:55,628 - INFO - Difficulty 152-153: 3 arguments
2025-04-20 19:24:55,628 - INFO - Difficulty 153-154: 3 arguments
2025-04-20 19:24:55,628 - INFO - Difficulty 154-155: 1 arguments
2025-04-20 19:24:55,628 - INFO - Difficulty 155-156: 2 arguments
2025-04-20 19:24:55,628 - INFO - Difficulty 156-157: 2 arguments
2025-04-20 19:24:55,628 - INFO - Difficulty 157-158: 1 arguments
2025-04-20 19:24:55,628 - INFO - Difficulty 158-159: 2 arguments
2025-04-20 19:24:55,628 - INFO - Difficulty 159-160: 2 arguments
2025-04-20 19:24:55,628 - INFO - Difficulty 160-161: 3 arguments
2025-04-20 19:24:55,628 - INFO - Difficulty 161-162: 1 arguments
2025-04-20 19:24:55,628 - INFO - Difficulty 162-163: 2 arguments
2025-04-20 19:24:55,628 - INFO - Difficulty 164-165: 1 arguments
2025-04-20 19:24:55,628 - INFO - Difficulty 167-168: 2 arguments
2025-04-20 19:24:55,628 - INFO - Difficulty 168-169: 7 arguments
2025-04-20 19:24:55,628 - INFO - Difficulty 169-170: 2 arguments
2025-04-20 19:24:55,628 - INFO - Difficulty 170-171: 4 arguments
2025-04-20 19:24:55,629 - INFO - Difficulty 171-172: 1 arguments
2025-04-20 19:24:55,629 - INFO - Difficulty 172-173: 1 arguments
2025-04-20 19:24:55,629 - INFO - Difficulty 173-174: 2 arguments
2025-04-20 19:24:55,629 - INFO - Difficulty 174-175: 1 arguments
2025-04-20 19:24:55,629 - INFO - Difficulty 175-176: 1 arguments
2025-04-20 19:24:55,629 - INFO - Difficulty 177-178: 1 arguments
2025-04-20 19:24:55,629 - INFO - Difficulty 178-179: 4 arguments
2025-04-20 19:24:55,629 - INFO - Difficulty 180-181: 1 arguments
2025-04-20 19:24:55,629 - INFO - Difficulty 181-182: 1 arguments
2025-04-20 19:24:55,629 - INFO - Difficulty 182-183: 1 arguments
2025-04-20 19:24:55,629 - INFO - Difficulty 183-184: 4 arguments
2025-04-20 19:24:55,629 - INFO - Difficulty 184-185: 5 arguments
2025-04-20 19:24:55,629 - INFO - Difficulty 190-191: 3 arguments
2025-04-20 19:24:55,629 - INFO - Difficulty 191-192: 1 arguments
2025-04-20 19:24:55,629 - INFO - Difficulty 192-193: 3 arguments
2025-04-20 19:24:55,629 - INFO - Difficulty 193-194: 1 arguments
2025-04-20 19:24:55,629 - INFO - Difficulty 195-196: 4 arguments
2025-04-20 19:24:55,629 - INFO - Difficulty 196-197: 4 arguments
2025-04-20 19:24:55,629 - INFO - Difficulty 197-198: 1 arguments
2025-04-20 19:24:55,629 - INFO - Difficulty 198-199: 1 arguments
2025-04-20 19:24:55,630 - INFO - Difficulty 199-200: 3 arguments
2025-04-20 19:24:55,630 - INFO - Difficulty 200-201: 2 arguments
2025-04-20 19:24:55,630 - INFO - Difficulty 201-202: 2 arguments
2025-04-20 19:24:55,630 - INFO - Difficulty 202-203: 1 arguments
2025-04-20 19:24:55,630 - INFO - Difficulty 203-204: 1 arguments
2025-04-20 19:24:55,630 - INFO - Difficulty 204-205: 6 arguments
2025-04-20 19:24:55,630 - INFO - Difficulty 205-206: 1 arguments
2025-04-20 19:24:55,630 - INFO - Difficulty 209-210: 2 arguments
2025-04-20 19:24:55,630 - INFO - Difficulty 210-211: 4 arguments
2025-04-20 19:24:55,630 - INFO - Difficulty 211-212: 2 arguments
2025-04-20 19:24:55,630 - INFO - Difficulty 212-213: 2 arguments
2025-04-20 19:24:55,630 - INFO - Difficulty 213-214: 1 arguments
2025-04-20 19:24:55,630 - INFO - Difficulty 215-216: 1 arguments
2025-04-20 19:24:55,630 - INFO - Difficulty 216-217: 1 arguments
2025-04-20 19:24:55,630 - INFO - Difficulty 219-220: 4 arguments
2025-04-20 19:24:55,630 - INFO - Difficulty 220-221: 3 arguments
2025-04-20 19:24:55,630 - INFO - Difficulty 222-223: 2 arguments
2025-04-20 19:24:55,630 - INFO - Difficulty 223-224: 3 arguments
2025-04-20 19:24:55,630 - INFO - Difficulty 224-225: 1 arguments
2025-04-20 19:24:55,630 - INFO - Difficulty 225-226: 2 arguments
2025-04-20 19:24:55,631 - INFO - Difficulty 226-227: 2 arguments
2025-04-20 19:24:55,631 - INFO - Difficulty 227-228: 1 arguments
2025-04-20 19:24:55,631 - INFO - Difficulty 229-230: 2 arguments
2025-04-20 19:24:55,631 - INFO - Difficulty 231-232: 1 arguments
2025-04-20 19:24:55,631 - INFO - Difficulty 236-237: 3 arguments
2025-04-20 19:24:55,631 - INFO - Difficulty 237-238: 3 arguments
2025-04-20 19:24:55,631 - INFO - Difficulty 239-240: 1 arguments
2025-04-20 19:24:55,631 - INFO - Difficulty 242-243: 1 arguments
2025-04-20 19:24:55,631 - INFO - Difficulty 243-244: 2 arguments
2025-04-20 19:24:55,631 - INFO - Difficulty 244-245: 3 arguments
2025-04-20 19:24:55,631 - INFO - Difficulty 245-246: 2 arguments
2025-04-20 19:24:55,631 - INFO - Difficulty 246-247: 2 arguments
2025-04-20 19:24:55,631 - INFO - Difficulty 247-248: 2 arguments
2025-04-20 19:24:55,631 - INFO - Difficulty 248-249: 2 arguments
2025-04-20 19:24:55,631 - INFO - Difficulty 250-251: 1 arguments
2025-04-20 19:24:55,631 - INFO - Difficulty 251-252: 2 arguments
2025-04-20 19:24:55,631 - INFO - Difficulty 252-253: 3 arguments
2025-04-20 19:24:55,631 - INFO - Difficulty 256-257: 4 arguments
2025-04-20 19:24:55,631 - INFO - Difficulty 258-259: 1 arguments
2025-04-20 19:24:55,632 - INFO - Difficulty 259-260: 1 arguments
2025-04-20 19:24:55,632 - INFO - Difficulty 262-263: 3 arguments
2025-04-20 19:24:55,632 - INFO - Difficulty 264-265: 1 arguments
2025-04-20 19:24:55,632 - INFO - Difficulty 269-270: 1 arguments
2025-04-20 19:24:55,632 - INFO - Difficulty 272-273: 3 arguments
2025-04-20 19:24:55,632 - INFO - Difficulty 274-275: 1 arguments
2025-04-20 19:24:55,632 - INFO - Difficulty 275-276: 1 arguments
2025-04-20 19:24:55,632 - INFO - Difficulty 276-277: 1 arguments
2025-04-20 19:24:55,632 - INFO - Difficulty 278-279: 3 arguments
2025-04-20 19:24:55,632 - INFO - Difficulty 279-280: 2 arguments
2025-04-20 19:24:55,632 - INFO - Difficulty 280-281: 3 arguments
2025-04-20 19:24:55,632 - INFO - Difficulty 281-282: 1 arguments
2025-04-20 19:24:55,632 - INFO - Difficulty 282-283: 2 arguments
2025-04-20 19:24:55,632 - INFO - Difficulty 283-284: 1 arguments
2025-04-20 19:24:55,632 - INFO - Difficulty 284-285: 2 arguments
2025-04-20 19:24:55,632 - INFO - Difficulty 285-286: 3 arguments
2025-04-20 19:24:55,632 - INFO - Difficulty 286-287: 1 arguments
2025-04-20 19:24:55,632 - INFO - Difficulty 288-289: 2 arguments
2025-04-20 19:24:55,632 - INFO - Difficulty 289-290: 1 arguments
2025-04-20 19:24:55,632 - INFO - Difficulty 290-291: 1 arguments
2025-04-20 19:24:55,633 - INFO - Difficulty 292-293: 1 arguments
2025-04-20 19:24:55,633 - INFO - Difficulty 296-297: 2 arguments
2025-04-20 19:24:55,633 - INFO - Difficulty 298-299: 1 arguments
2025-04-20 19:24:55,633 - INFO - Difficulty 299-300: 1 arguments
2025-04-20 19:24:55,633 - INFO - Difficulty 302-303: 1 arguments
2025-04-20 19:24:55,633 - INFO - Difficulty 303-304: 2 arguments
2025-04-20 19:24:55,633 - INFO - Difficulty 306-307: 2 arguments
2025-04-20 19:24:55,633 - INFO - Difficulty 309-310: 2 arguments
2025-04-20 19:24:55,633 - INFO - Difficulty 310-311: 1 arguments
2025-04-20 19:24:55,633 - INFO - Difficulty 313-314: 3 arguments
2025-04-20 19:24:55,633 - INFO - Difficulty 318-319: 1 arguments
2025-04-20 19:24:55,633 - INFO - Difficulty 320-321: 1 arguments
2025-04-20 19:24:55,633 - INFO - Difficulty 321-322: 1 arguments
2025-04-20 19:24:55,633 - INFO - Difficulty 323-324: 1 arguments
2025-04-20 19:24:55,633 - INFO - Difficulty 325-326: 3 arguments
2025-04-20 19:24:55,633 - INFO - Difficulty 326-327: 1 arguments
2025-04-20 19:24:55,633 - INFO - Difficulty 328-329: 1 arguments
2025-04-20 19:24:55,633 - INFO - Difficulty 333-334: 2 arguments
2025-04-20 19:24:55,633 - INFO - Difficulty 334-335: 1 arguments
2025-04-20 19:24:55,634 - INFO - Difficulty 335-336: 1 arguments
2025-04-20 19:24:55,634 - INFO - Difficulty 337-338: 3 arguments
2025-04-20 19:24:55,634 - INFO - Difficulty 338-339: 2 arguments
2025-04-20 19:24:55,634 - INFO - Difficulty 339-340: 1 arguments
2025-04-20 19:24:55,634 - INFO - Difficulty 344-345: 1 arguments
2025-04-20 19:24:55,634 - INFO - Difficulty 346-347: 1 arguments
2025-04-20 19:24:55,634 - INFO - Difficulty 348-349: 2 arguments
2025-04-20 19:24:55,634 - INFO - Difficulty 351-352: 1 arguments
2025-04-20 19:24:55,634 - INFO - Difficulty 352-353: 2 arguments
2025-04-20 19:24:55,634 - INFO - Difficulty 354-355: 3 arguments
2025-04-20 19:24:55,634 - INFO - Difficulty 357-358: 5 arguments
2025-04-20 19:24:55,634 - INFO - Difficulty 358-359: 1 arguments
2025-04-20 19:24:55,634 - INFO - Difficulty 361-362: 1 arguments
2025-04-20 19:24:55,634 - INFO - Difficulty 362-363: 2 arguments
2025-04-20 19:24:55,634 - INFO - Difficulty 363-364: 2 arguments
2025-04-20 19:24:55,634 - INFO - Difficulty 365-366: 1 arguments
2025-04-20 19:24:55,634 - INFO - Difficulty 366-367: 2 arguments
2025-04-20 19:24:55,634 - INFO - Difficulty 367-368: 2 arguments
2025-04-20 19:24:55,634 - INFO - Difficulty 368-369: 1 arguments
2025-04-20 19:24:55,634 - INFO - Difficulty 370-371: 2 arguments
2025-04-20 19:24:55,635 - INFO - Difficulty 371-372: 1 arguments
2025-04-20 19:24:55,635 - INFO - Difficulty 372-373: 1 arguments
2025-04-20 19:24:55,635 - INFO - Difficulty 373-374: 1 arguments
2025-04-20 19:24:55,635 - INFO - Difficulty 374-375: 1 arguments
2025-04-20 19:24:55,635 - INFO - Difficulty 380-381: 1 arguments
2025-04-20 19:24:55,635 - INFO - Difficulty 390-391: 1 arguments
2025-04-20 19:24:55,635 - INFO - Difficulty 391-392: 1 arguments
2025-04-20 19:24:55,635 - INFO - Difficulty 393-394: 1 arguments
2025-04-20 19:24:55,635 - INFO - Difficulty 396-397: 1 arguments
2025-04-20 19:24:55,635 - INFO - Difficulty 398-399: 2 arguments
2025-04-20 19:24:55,635 - INFO - Difficulty 399-400: 3 arguments
2025-04-20 19:24:55,635 - INFO - Difficulty 400-401: 1 arguments
2025-04-20 19:24:55,635 - INFO - Difficulty 407-408: 1 arguments
2025-04-20 19:24:55,635 - INFO - Difficulty 409-410: 1 arguments
2025-04-20 19:24:55,635 - INFO - Difficulty 410-411: 1 arguments
2025-04-20 19:24:55,635 - INFO - Difficulty 411-412: 1 arguments
2025-04-20 19:24:55,635 - INFO - Difficulty 412-413: 1 arguments
2025-04-20 19:24:55,635 - INFO - Difficulty 414-415: 1 arguments
2025-04-20 19:24:55,635 - INFO - Difficulty 415-416: 1 arguments
2025-04-20 19:24:55,635 - INFO - Difficulty 418-419: 1 arguments
2025-04-20 19:24:55,635 - INFO - Difficulty 419-420: 1 arguments
2025-04-20 19:24:55,636 - INFO - Difficulty 420-421: 1 arguments
2025-04-20 19:24:55,636 - INFO - Difficulty 421-422: 2 arguments
2025-04-20 19:24:55,636 - INFO - Difficulty 422-423: 1 arguments
2025-04-20 19:24:55,636 - INFO - Difficulty 423-424: 1 arguments
2025-04-20 19:24:55,636 - INFO - Difficulty 426-427: 1 arguments
2025-04-20 19:24:55,636 - INFO - Difficulty 427-428: 2 arguments
2025-04-20 19:24:55,636 - INFO - Difficulty 434-435: 1 arguments
2025-04-20 19:24:55,636 - INFO - Difficulty 435-436: 3 arguments
2025-04-20 19:24:55,636 - INFO - Difficulty 437-438: 1 arguments
2025-04-20 19:24:55,636 - INFO - Difficulty 444-445: 1 arguments
2025-04-20 19:24:55,636 - INFO - Difficulty 445-446: 1 arguments
2025-04-20 19:24:55,636 - INFO - Difficulty 446-447: 1 arguments
2025-04-20 19:24:55,636 - INFO - Difficulty 449-450: 2 arguments
2025-04-20 19:24:55,636 - INFO - Difficulty 450-451: 1 arguments
2025-04-20 19:24:55,636 - INFO - Difficulty 451-452: 1 arguments
2025-04-20 19:24:55,636 - INFO - Difficulty 454-455: 1 arguments
2025-04-20 19:24:55,636 - INFO - Difficulty 455-456: 1 arguments
2025-04-20 19:24:55,636 - INFO - Difficulty 456-457: 1 arguments
2025-04-20 19:24:55,636 - INFO - Difficulty 457-458: 2 arguments
2025-04-20 19:24:55,636 - INFO - Difficulty 459-460: 1 arguments
2025-04-20 19:24:55,637 - INFO - Difficulty 461-462: 1 arguments
2025-04-20 19:24:55,637 - INFO - Difficulty 462-463: 2 arguments
2025-04-20 19:24:55,637 - INFO - Difficulty 463-464: 1 arguments
2025-04-20 19:24:55,637 - INFO - Difficulty 465-466: 1 arguments
2025-04-20 19:24:55,637 - INFO - Difficulty 466-467: 1 arguments
2025-04-20 19:24:55,637 - INFO - Difficulty 467-468: 1 arguments
2025-04-20 19:24:55,637 - INFO - Difficulty 468-469: 1 arguments
2025-04-20 19:24:55,637 - INFO - Difficulty 469-470: 3 arguments
2025-04-20 19:24:55,637 - INFO - Difficulty 470-471: 2 arguments
2025-04-20 19:24:55,637 - INFO - Difficulty 473-474: 1 arguments
2025-04-20 19:24:55,637 - INFO - Difficulty 474-475: 1 arguments
2025-04-20 19:24:55,637 - INFO - Difficulty 478-479: 1 arguments
2025-04-20 19:24:55,637 - INFO - Difficulty 480-481: 1 arguments
2025-04-20 19:24:55,637 - INFO - Difficulty 481-482: 4 arguments
2025-04-20 19:24:55,637 - INFO - Difficulty 482-483: 1 arguments
2025-04-20 19:24:55,637 - INFO - Difficulty 491-492: 1 arguments
2025-04-20 19:24:55,637 - INFO - Difficulty 502-503: 2 arguments
2025-04-20 19:24:55,637 - INFO - Difficulty 503-504: 1 arguments
2025-04-20 19:24:55,637 - INFO - Difficulty 506-507: 2 arguments
2025-04-20 19:24:55,637 - INFO - Difficulty 507-508: 1 arguments
2025-04-20 19:24:55,637 - INFO - Difficulty 508-509: 1 arguments
2025-04-20 19:24:55,637 - INFO - Difficulty 511-512: 1 arguments
2025-04-20 19:24:55,638 - INFO - Difficulty 513-514: 1 arguments
2025-04-20 19:24:55,638 - INFO - === End Update ===

2025-04-20 19:24:55,638 - INFO - Restarting search...
2025-04-20 20:28:04,939 - INFO - 
=== Final Summary ===
2025-04-20 20:28:04,940 - INFO - Total premises processed: 1000
2025-04-20 20:28:04,940 - INFO - Total valid arguments: 1641
2025-04-20 20:28:04,940 - INFO - Total invalid arguments: 20380
2025-04-20 20:28:04,940 - INFO - Total time: 16744.98 seconds
2025-04-20 20:28:04,940 - INFO - Average time per premise: 16.74 seconds
2025-04-20 20:28:04,940 - INFO - === End Summary ===

