2025-04-18 23:19:44,629 - INFO - Starting argument generation. Log file: logs/arg_generation_20250418_231944.log
2025-04-18 23:19:44,629 - INFO - Parameters: total_premises=10000, batch_size=100, restart_interval=1000
2025-04-19 03:07:16,789 - INFO - 
=== Progress Update ===
2025-04-19 03:07:16,789 - INFO - Processed premises: 1000/10000
2025-04-19 03:07:16,789 - INFO - Total elapsed time: 13652.16 seconds
2025-04-19 03:07:16,789 - INFO - Time since last save: 13652.16 seconds
2025-04-19 03:07:16,790 - INFO - Valid arguments found: 440
2025-04-19 03:07:16,790 - INFO - Invalid arguments found: 4888
2025-04-19 03:07:16,790 - INFO - Average time per premise: 13.65 seconds
2025-04-19 03:07:16,790 - INFO - 
Difficulty Distribution:
2025-04-19 03:07:16,790 - INFO - Difficulty 15-16: 2 arguments
2025-04-19 03:07:16,790 - INFO - Difficulty 16-17: 1 arguments
2025-04-19 03:07:16,790 - INFO - Difficulty 17-18: 2 arguments
2025-04-19 03:07:16,790 - INFO - Difficulty 18-19: 9 arguments
2025-04-19 03:07:16,790 - INFO - Difficulty 19-20: 4 arguments
2025-04-19 03:07:16,790 - INFO - Difficulty 20-21: 6 arguments
2025-04-19 03:07:16,790 - INFO - Difficulty 21-22: 7 arguments
2025-04-19 03:07:16,790 - INFO - Difficulty 22-23: 5 arguments
2025-04-19 03:07:16,790 - INFO - Difficulty 23-24: 16 arguments
2025-04-19 03:07:16,791 - INFO - Difficulty 24-25: 8 arguments
2025-04-19 03:07:16,791 - INFO - Difficulty 25-26: 10 arguments
2025-04-19 03:07:16,791 - INFO - Difficulty 26-27: 6 arguments
2025-04-19 03:07:16,791 - INFO - Difficulty 27-28: 11 arguments
2025-04-19 03:07:16,791 - INFO - Difficulty 28-29: 4 arguments
2025-04-19 03:07:16,791 - INFO - Difficulty 29-30: 2 arguments
2025-04-19 03:07:16,791 - INFO - Difficulty 30-31: 1 arguments
2025-04-19 03:07:16,791 - INFO - Difficulty 31-32: 6 arguments
2025-04-19 03:07:16,791 - INFO - Difficulty 32-33: 5 arguments
2025-04-19 03:07:16,791 - INFO - Difficulty 33-34: 4 arguments
2025-04-19 03:07:16,791 - INFO - Difficulty 34-35: 2 arguments
2025-04-19 03:07:16,791 - INFO - Difficulty 35-36: 4 arguments
2025-04-19 03:07:16,791 - INFO - Difficulty 36-37: 3 arguments
2025-04-19 03:07:16,791 - INFO - Difficulty 37-38: 3 arguments
2025-04-19 03:07:16,791 - INFO - Difficulty 38-39: 4 arguments
2025-04-19 03:07:16,791 - INFO - Difficulty 39-40: 5 arguments
2025-04-19 03:07:16,791 - INFO - Difficulty 40-41: 7 arguments
2025-04-19 03:07:16,792 - INFO - Difficulty 41-42: 3 arguments
2025-04-19 03:07:16,792 - INFO - Difficulty 42-43: 2 arguments
2025-04-19 03:07:16,792 - INFO - Difficulty 43-44: 2 arguments
2025-04-19 03:07:16,792 - INFO - Difficulty 44-45: 4 arguments
2025-04-19 03:07:16,792 - INFO - Difficulty 45-46: 3 arguments
2025-04-19 03:07:16,792 - INFO - Difficulty 46-47: 7 arguments
2025-04-19 03:07:16,792 - INFO - Difficulty 47-48: 6 arguments
2025-04-19 03:07:16,792 - INFO - Difficulty 48-49: 2 arguments
2025-04-19 03:07:16,792 - INFO - Difficulty 49-50: 3 arguments
2025-04-19 03:07:16,792 - INFO - Difficulty 50-51: 3 arguments
2025-04-19 03:07:16,792 - INFO - Difficulty 51-52: 2 arguments
2025-04-19 03:07:16,792 - INFO - Difficulty 52-53: 1 arguments
2025-04-19 03:07:16,792 - INFO - Difficulty 53-54: 4 arguments
2025-04-19 03:07:16,792 - INFO - Difficulty 54-55: 5 arguments
2025-04-19 03:07:16,792 - INFO - Difficulty 55-56: 1 arguments
2025-04-19 03:07:16,792 - INFO - Difficulty 56-57: 6 arguments
2025-04-19 03:07:16,792 - INFO - Difficulty 58-59: 3 arguments
2025-04-19 03:07:16,792 - INFO - Difficulty 59-60: 3 arguments
2025-04-19 03:07:16,793 - INFO - Difficulty 60-61: 2 arguments
2025-04-19 03:07:16,793 - INFO - Difficulty 61-62: 5 arguments
2025-04-19 03:07:16,793 - INFO - Difficulty 62-63: 4 arguments
2025-04-19 03:07:16,793 - INFO - Difficulty 63-64: 1 arguments
2025-04-19 03:07:16,793 - INFO - Difficulty 64-65: 2 arguments
2025-04-19 03:07:16,793 - INFO - Difficulty 65-66: 2 arguments
2025-04-19 03:07:16,793 - INFO - Difficulty 66-67: 2 arguments
2025-04-19 03:07:16,793 - INFO - Difficulty 67-68: 6 arguments
2025-04-19 03:07:16,793 - INFO - Difficulty 69-70: 8 arguments
2025-04-19 03:07:16,793 - INFO - Difficulty 70-71: 7 arguments
2025-04-19 03:07:16,793 - INFO - Difficulty 71-72: 4 arguments
2025-04-19 03:07:16,793 - INFO - Difficulty 72-73: 3 arguments
2025-04-19 03:07:16,793 - INFO - Difficulty 73-74: 3 arguments
2025-04-19 03:07:16,793 - INFO - Difficulty 74-75: 3 arguments
2025-04-19 03:07:16,793 - INFO - Difficulty 75-76: 2 arguments
2025-04-19 03:07:16,793 - INFO - Difficulty 76-77: 6 arguments
2025-04-19 03:07:16,793 - INFO - Difficulty 77-78: 4 arguments
2025-04-19 03:07:16,794 - INFO - Difficulty 79-80: 2 arguments
2025-04-19 03:07:16,794 - INFO - Difficulty 80-81: 2 arguments
2025-04-19 03:07:16,794 - INFO - Difficulty 81-82: 4 arguments
2025-04-19 03:07:16,794 - INFO - Difficulty 82-83: 3 arguments
2025-04-19 03:07:16,794 - INFO - Difficulty 83-84: 2 arguments
2025-04-19 03:07:16,794 - INFO - Difficulty 84-85: 1 arguments
2025-04-19 03:07:16,794 - INFO - Difficulty 85-86: 2 arguments
2025-04-19 03:07:16,794 - INFO - Difficulty 86-87: 3 arguments
2025-04-19 03:07:16,794 - INFO - Difficulty 87-88: 4 arguments
2025-04-19 03:07:16,794 - INFO - Difficulty 90-91: 1 arguments
2025-04-19 03:07:16,794 - INFO - Difficulty 91-92: 1 arguments
2025-04-19 03:07:16,794 - INFO - Difficulty 92-93: 2 arguments
2025-04-19 03:07:16,794 - INFO - Difficulty 93-94: 2 arguments
2025-04-19 03:07:16,794 - INFO - Difficulty 95-96: 1 arguments
2025-04-19 03:07:16,794 - INFO - Difficulty 97-98: 1 arguments
2025-04-19 03:07:16,794 - INFO - Difficulty 98-99: 3 arguments
2025-04-19 03:07:16,794 - INFO - Difficulty 99-100: 2 arguments
2025-04-19 03:07:16,794 - INFO - Difficulty 102-103: 1 arguments
2025-04-19 03:07:16,794 - INFO - Difficulty 103-104: 2 arguments
2025-04-19 03:07:16,795 - INFO - Difficulty 104-105: 1 arguments
2025-04-19 03:07:16,795 - INFO - Difficulty 105-106: 2 arguments
2025-04-19 03:07:16,795 - INFO - Difficulty 106-107: 1 arguments
2025-04-19 03:07:16,795 - INFO - Difficulty 107-108: 1 arguments
2025-04-19 03:07:16,795 - INFO - Difficulty 108-109: 2 arguments
2025-04-19 03:07:16,795 - INFO - Difficulty 109-110: 2 arguments
2025-04-19 03:07:16,795 - INFO - Difficulty 110-111: 2 arguments
2025-04-19 03:07:16,795 - INFO - Difficulty 111-112: 1 arguments
2025-04-19 03:07:16,795 - INFO - Difficulty 112-113: 3 arguments
2025-04-19 03:07:16,795 - INFO - Difficulty 116-117: 1 arguments
2025-04-19 03:07:16,795 - INFO - Difficulty 117-118: 1 arguments
2025-04-19 03:07:16,795 - INFO - Difficulty 118-119: 2 arguments
2025-04-19 03:07:16,795 - INFO - Difficulty 122-123: 1 arguments
2025-04-19 03:07:16,795 - INFO - Difficulty 124-125: 1 arguments
2025-04-19 03:07:16,795 - INFO - Difficulty 125-126: 1 arguments
2025-04-19 03:07:16,795 - INFO - Difficulty 132-133: 1 arguments
2025-04-19 03:07:16,795 - INFO - Difficulty 136-137: 1 arguments
2025-04-19 03:07:16,795 - INFO - Difficulty 138-139: 1 arguments
2025-04-19 03:07:16,796 - INFO - Difficulty 146-147: 1 arguments
2025-04-19 03:07:16,796 - INFO - Difficulty 150-151: 1 arguments
2025-04-19 03:07:16,796 - INFO - Difficulty 152-153: 1 arguments
2025-04-19 03:07:16,796 - INFO - Difficulty 153-154: 1 arguments
2025-04-19 03:07:16,796 - INFO - Difficulty 154-155: 1 arguments
2025-04-19 03:07:16,796 - INFO - Difficulty 155-156: 1 arguments
2025-04-19 03:07:16,796 - INFO - Difficulty 156-157: 1 arguments
2025-04-19 03:07:16,796 - INFO - Difficulty 158-159: 2 arguments
2025-04-19 03:07:16,796 - INFO - Difficulty 160-161: 2 arguments
2025-04-19 03:07:16,796 - INFO - Difficulty 161-162: 1 arguments
2025-04-19 03:07:16,796 - INFO - Difficulty 162-163: 2 arguments
2025-04-19 03:07:16,796 - INFO - Difficulty 168-169: 1 arguments
2025-04-19 03:07:16,796 - INFO - Difficulty 171-172: 1 arguments
2025-04-19 03:07:16,796 - INFO - Difficulty 173-174: 2 arguments
2025-04-19 03:07:16,796 - INFO - Difficulty 177-178: 1 arguments
2025-04-19 03:07:16,796 - INFO - Difficulty 178-179: 2 arguments
2025-04-19 03:07:16,796 - INFO - Difficulty 180-181: 1 arguments
2025-04-19 03:07:16,796 - INFO - Difficulty 181-182: 1 arguments
2025-04-19 03:07:16,796 - INFO - Difficulty 190-191: 2 arguments
2025-04-19 03:07:16,797 - INFO - Difficulty 191-192: 1 arguments
2025-04-19 03:07:16,797 - INFO - Difficulty 192-193: 2 arguments
2025-04-19 03:07:16,797 - INFO - Difficulty 193-194: 1 arguments
2025-04-19 03:07:16,797 - INFO - Difficulty 195-196: 3 arguments
2025-04-19 03:07:16,797 - INFO - Difficulty 196-197: 1 arguments
2025-04-19 03:07:16,797 - INFO - Difficulty 198-199: 1 arguments
2025-04-19 03:07:16,797 - INFO - Difficulty 199-200: 2 arguments
2025-04-19 03:07:16,797 - INFO - Difficulty 200-201: 1 arguments
2025-04-19 03:07:16,797 - INFO - Difficulty 201-202: 1 arguments
2025-04-19 03:07:16,797 - INFO - Difficulty 203-204: 1 arguments
2025-04-19 03:07:16,797 - INFO - Difficulty 204-205: 1 arguments
2025-04-19 03:07:16,797 - INFO - Difficulty 210-211: 1 arguments
2025-04-19 03:07:16,797 - INFO - Difficulty 211-212: 1 arguments
2025-04-19 03:07:16,797 - INFO - Difficulty 216-217: 1 arguments
2025-04-19 03:07:16,797 - INFO - Difficulty 220-221: 1 arguments
2025-04-19 03:07:16,797 - INFO - Difficulty 223-224: 1 arguments
2025-04-19 03:07:16,797 - INFO - Difficulty 226-227: 1 arguments
2025-04-19 03:07:16,797 - INFO - Difficulty 227-228: 1 arguments
2025-04-19 03:07:16,798 - INFO - Difficulty 236-237: 2 arguments
2025-04-19 03:07:16,798 - INFO - Difficulty 237-238: 2 arguments
2025-04-19 03:07:16,798 - INFO - Difficulty 250-251: 1 arguments
2025-04-19 03:07:16,798 - INFO - Difficulty 251-252: 1 arguments
2025-04-19 03:07:16,798 - INFO - Difficulty 252-253: 1 arguments
2025-04-19 03:07:16,798 - INFO - Difficulty 258-259: 1 arguments
2025-04-19 03:07:16,798 - INFO - Difficulty 259-260: 1 arguments
2025-04-19 03:07:16,798 - INFO - Difficulty 262-263: 2 arguments
2025-04-19 03:07:16,798 - INFO - Difficulty 272-273: 1 arguments
2025-04-19 03:07:16,798 - INFO - Difficulty 276-277: 1 arguments
2025-04-19 03:07:16,798 - INFO - Difficulty 278-279: 1 arguments
2025-04-19 03:07:16,798 - INFO - Difficulty 279-280: 1 arguments
2025-04-19 03:07:16,798 - INFO - Difficulty 280-281: 2 arguments
2025-04-19 03:07:16,798 - INFO - Difficulty 282-283: 1 arguments
2025-04-19 03:07:16,798 - INFO - Difficulty 283-284: 1 arguments
2025-04-19 03:07:16,798 - INFO - Difficulty 284-285: 1 arguments
2025-04-19 03:07:16,798 - INFO - Difficulty 285-286: 1 arguments
2025-04-19 03:07:16,798 - INFO - Difficulty 292-293: 1 arguments
2025-04-19 03:07:16,798 - INFO - Difficulty 299-300: 1 arguments
2025-04-19 03:07:16,799 - INFO - Difficulty 303-304: 1 arguments
2025-04-19 03:07:16,799 - INFO - Difficulty 306-307: 1 arguments
2025-04-19 03:07:16,799 - INFO - Difficulty 313-314: 1 arguments
2025-04-19 03:07:16,799 - INFO - Difficulty 321-322: 1 arguments
2025-04-19 03:07:16,799 - INFO - Difficulty 323-324: 1 arguments
2025-04-19 03:07:16,799 - INFO - Difficulty 337-338: 1 arguments
2025-04-19 03:07:16,799 - INFO - Difficulty 344-345: 1 arguments
2025-04-19 03:07:16,799 - INFO - Difficulty 348-349: 1 arguments
2025-04-19 03:07:16,799 - INFO - Difficulty 357-358: 1 arguments
2025-04-19 03:07:16,799 - INFO - Difficulty 361-362: 1 arguments
2025-04-19 03:07:16,799 - INFO - Difficulty 370-371: 1 arguments
2025-04-19 03:07:16,799 - INFO - Difficulty 371-372: 1 arguments
2025-04-19 03:07:16,799 - INFO - Difficulty 391-392: 1 arguments
2025-04-19 03:07:16,799 - INFO - Difficulty 396-397: 1 arguments
2025-04-19 03:07:16,799 - INFO - Difficulty 398-399: 2 arguments
2025-04-19 03:07:16,799 - INFO - Difficulty 399-400: 3 arguments
2025-04-19 03:07:16,799 - INFO - Difficulty 400-401: 1 arguments
2025-04-19 03:07:16,799 - INFO - Difficulty 409-410: 1 arguments
2025-04-19 03:07:16,799 - INFO - Difficulty 411-412: 1 arguments
2025-04-19 03:07:16,800 - INFO - Difficulty 414-415: 1 arguments
2025-04-19 03:07:16,800 - INFO - Difficulty 415-416: 1 arguments
2025-04-19 03:07:16,800 - INFO - Difficulty 419-420: 1 arguments
2025-04-19 03:07:16,800 - INFO - Difficulty 420-421: 1 arguments
2025-04-19 03:07:16,800 - INFO - Difficulty 421-422: 1 arguments
2025-04-19 03:07:16,800 - INFO - Difficulty 426-427: 1 arguments
2025-04-19 03:07:16,800 - INFO - Difficulty 435-436: 1 arguments
2025-04-19 03:07:16,800 - INFO - Difficulty 437-438: 1 arguments
2025-04-19 03:07:16,800 - INFO - Difficulty 444-445: 1 arguments
2025-04-19 03:07:16,800 - INFO - Difficulty 455-456: 1 arguments
2025-04-19 03:07:16,800 - INFO - Difficulty 456-457: 1 arguments
2025-04-19 03:07:16,800 - INFO - Difficulty 457-458: 1 arguments
2025-04-19 03:07:16,800 - INFO - Difficulty 461-462: 1 arguments
2025-04-19 03:07:16,800 - INFO - Difficulty 462-463: 1 arguments
2025-04-19 03:07:16,800 - INFO - Difficulty 465-466: 1 arguments
2025-04-19 03:07:16,800 - INFO - Difficulty 467-468: 1 arguments
2025-04-19 03:07:16,800 - INFO - Difficulty 468-469: 1 arguments
2025-04-19 03:07:16,800 - INFO - Difficulty 469-470: 1 arguments
2025-04-19 03:07:16,801 - INFO - Difficulty 470-471: 1 arguments
2025-04-19 03:07:16,801 - INFO - Difficulty 491-492: 1 arguments
2025-04-19 03:07:16,801 - INFO - Difficulty 502-503: 2 arguments
2025-04-19 03:07:16,801 - INFO - Difficulty 513-514: 1 arguments
2025-04-19 03:07:16,801 - INFO - === End Update ===

2025-04-19 03:07:16,801 - INFO - Restarting search...
2025-04-19 06:41:18,589 - INFO - 
=== Progress Update ===
2025-04-19 06:41:18,589 - INFO - Processed premises: 2000/10000
2025-04-19 06:41:18,589 - INFO - Total elapsed time: 26493.96 seconds
2025-04-19 06:41:18,589 - INFO - Time since last save: 12841.80 seconds
2025-04-19 06:41:18,589 - INFO - Valid arguments found: 440
2025-04-19 06:41:18,589 - INFO - Invalid arguments found: 4888
2025-04-19 06:41:18,589 - INFO - Average time per premise: 13.25 seconds
2025-04-19 06:41:18,589 - INFO - 
Difficulty Distribution:
2025-04-19 06:41:18,590 - INFO - Difficulty 15-16: 2 arguments
2025-04-19 06:41:18,590 - INFO - Difficulty 16-17: 1 arguments
2025-04-19 06:41:18,590 - INFO - Difficulty 17-18: 2 arguments
2025-04-19 06:41:18,590 - INFO - Difficulty 18-19: 9 arguments
2025-04-19 06:41:18,590 - INFO - Difficulty 19-20: 4 arguments
2025-04-19 06:41:18,590 - INFO - Difficulty 20-21: 6 arguments
2025-04-19 06:41:18,590 - INFO - Difficulty 21-22: 7 arguments
2025-04-19 06:41:18,590 - INFO - Difficulty 22-23: 5 arguments
2025-04-19 06:41:18,590 - INFO - Difficulty 23-24: 16 arguments
2025-04-19 06:41:18,590 - INFO - Difficulty 24-25: 8 arguments
2025-04-19 06:41:18,590 - INFO - Difficulty 25-26: 10 arguments
2025-04-19 06:41:18,590 - INFO - Difficulty 26-27: 6 arguments
2025-04-19 06:41:18,590 - INFO - Difficulty 27-28: 11 arguments
2025-04-19 06:41:18,590 - INFO - Difficulty 28-29: 4 arguments
2025-04-19 06:41:18,590 - INFO - Difficulty 29-30: 2 arguments
2025-04-19 06:41:18,590 - INFO - Difficulty 30-31: 1 arguments
2025-04-19 06:41:18,590 - INFO - Difficulty 31-32: 6 arguments
2025-04-19 06:41:18,591 - INFO - Difficulty 32-33: 5 arguments
2025-04-19 06:41:18,591 - INFO - Difficulty 33-34: 4 arguments
2025-04-19 06:41:18,591 - INFO - Difficulty 34-35: 2 arguments
2025-04-19 06:41:18,591 - INFO - Difficulty 35-36: 4 arguments
2025-04-19 06:41:18,591 - INFO - Difficulty 36-37: 3 arguments
2025-04-19 06:41:18,591 - INFO - Difficulty 37-38: 3 arguments
2025-04-19 06:41:18,591 - INFO - Difficulty 38-39: 4 arguments
2025-04-19 06:41:18,591 - INFO - Difficulty 39-40: 5 arguments
2025-04-19 06:41:18,591 - INFO - Difficulty 40-41: 7 arguments
2025-04-19 06:41:18,591 - INFO - Difficulty 41-42: 3 arguments
2025-04-19 06:41:18,591 - INFO - Difficulty 42-43: 2 arguments
2025-04-19 06:41:18,591 - INFO - Difficulty 43-44: 2 arguments
2025-04-19 06:41:18,591 - INFO - Difficulty 44-45: 4 arguments
2025-04-19 06:41:18,591 - INFO - Difficulty 45-46: 3 arguments
2025-04-19 06:41:18,591 - INFO - Difficulty 46-47: 7 arguments
2025-04-19 06:41:18,591 - INFO - Difficulty 47-48: 6 arguments
2025-04-19 06:41:18,591 - INFO - Difficulty 48-49: 2 arguments
2025-04-19 06:41:18,591 - INFO - Difficulty 49-50: 3 arguments
2025-04-19 06:41:18,592 - INFO - Difficulty 50-51: 3 arguments
2025-04-19 06:41:18,592 - INFO - Difficulty 51-52: 2 arguments
2025-04-19 06:41:18,592 - INFO - Difficulty 52-53: 1 arguments
2025-04-19 06:41:18,592 - INFO - Difficulty 53-54: 4 arguments
2025-04-19 06:41:18,592 - INFO - Difficulty 54-55: 5 arguments
2025-04-19 06:41:18,592 - INFO - Difficulty 55-56: 1 arguments
2025-04-19 06:41:18,592 - INFO - Difficulty 56-57: 6 arguments
2025-04-19 06:41:18,592 - INFO - Difficulty 58-59: 3 arguments
2025-04-19 06:41:18,592 - INFO - Difficulty 59-60: 3 arguments
2025-04-19 06:41:18,592 - INFO - Difficulty 60-61: 2 arguments
2025-04-19 06:41:18,592 - INFO - Difficulty 61-62: 5 arguments
2025-04-19 06:41:18,592 - INFO - Difficulty 62-63: 4 arguments
2025-04-19 06:41:18,592 - INFO - Difficulty 63-64: 1 arguments
2025-04-19 06:41:18,592 - INFO - Difficulty 64-65: 2 arguments
2025-04-19 06:41:18,592 - INFO - Difficulty 65-66: 2 arguments
2025-04-19 06:41:18,592 - INFO - Difficulty 66-67: 2 arguments
2025-04-19 06:41:18,592 - INFO - Difficulty 67-68: 6 arguments
2025-04-19 06:41:18,592 - INFO - Difficulty 69-70: 8 arguments
2025-04-19 06:41:18,593 - INFO - Difficulty 70-71: 7 arguments
2025-04-19 06:41:18,593 - INFO - Difficulty 71-72: 4 arguments
2025-04-19 06:41:18,593 - INFO - Difficulty 72-73: 3 arguments
2025-04-19 06:41:18,593 - INFO - Difficulty 73-74: 3 arguments
2025-04-19 06:41:18,593 - INFO - Difficulty 74-75: 3 arguments
2025-04-19 06:41:18,593 - INFO - Difficulty 75-76: 2 arguments
2025-04-19 06:41:18,593 - INFO - Difficulty 76-77: 6 arguments
2025-04-19 06:41:18,593 - INFO - Difficulty 77-78: 4 arguments
2025-04-19 06:41:18,593 - INFO - Difficulty 79-80: 2 arguments
2025-04-19 06:41:18,593 - INFO - Difficulty 80-81: 2 arguments
2025-04-19 06:41:18,593 - INFO - Difficulty 81-82: 4 arguments
2025-04-19 06:41:18,593 - INFO - Difficulty 82-83: 3 arguments
2025-04-19 06:41:18,593 - INFO - Difficulty 83-84: 2 arguments
2025-04-19 06:41:18,593 - INFO - Difficulty 84-85: 1 arguments
2025-04-19 06:41:18,593 - INFO - Difficulty 85-86: 2 arguments
2025-04-19 06:41:18,593 - INFO - Difficulty 86-87: 3 arguments
2025-04-19 06:41:18,593 - INFO - Difficulty 87-88: 4 arguments
2025-04-19 06:41:18,593 - INFO - Difficulty 90-91: 1 arguments
2025-04-19 06:41:18,594 - INFO - Difficulty 91-92: 1 arguments
2025-04-19 06:41:18,594 - INFO - Difficulty 92-93: 2 arguments
2025-04-19 06:41:18,594 - INFO - Difficulty 93-94: 2 arguments
2025-04-19 06:41:18,594 - INFO - Difficulty 95-96: 1 arguments
2025-04-19 06:41:18,594 - INFO - Difficulty 97-98: 1 arguments
2025-04-19 06:41:18,594 - INFO - Difficulty 98-99: 3 arguments
2025-04-19 06:41:18,594 - INFO - Difficulty 99-100: 2 arguments
2025-04-19 06:41:18,594 - INFO - Difficulty 102-103: 1 arguments
2025-04-19 06:41:18,594 - INFO - Difficulty 103-104: 2 arguments
2025-04-19 06:41:18,594 - INFO - Difficulty 104-105: 1 arguments
2025-04-19 06:41:18,594 - INFO - Difficulty 105-106: 2 arguments
2025-04-19 06:41:18,594 - INFO - Difficulty 106-107: 1 arguments
2025-04-19 06:41:18,594 - INFO - Difficulty 107-108: 1 arguments
2025-04-19 06:41:18,594 - INFO - Difficulty 108-109: 2 arguments
2025-04-19 06:41:18,594 - INFO - Difficulty 109-110: 2 arguments
2025-04-19 06:41:18,594 - INFO - Difficulty 110-111: 2 arguments
2025-04-19 06:41:18,594 - INFO - Difficulty 111-112: 1 arguments
2025-04-19 06:41:18,594 - INFO - Difficulty 112-113: 3 arguments
2025-04-19 06:41:18,594 - INFO - Difficulty 116-117: 1 arguments
2025-04-19 06:41:18,595 - INFO - Difficulty 117-118: 1 arguments
2025-04-19 06:41:18,595 - INFO - Difficulty 118-119: 2 arguments
2025-04-19 06:41:18,595 - INFO - Difficulty 122-123: 1 arguments
2025-04-19 06:41:18,595 - INFO - Difficulty 124-125: 1 arguments
2025-04-19 06:41:18,595 - INFO - Difficulty 125-126: 1 arguments
2025-04-19 06:41:18,595 - INFO - Difficulty 132-133: 1 arguments
2025-04-19 06:41:18,595 - INFO - Difficulty 136-137: 1 arguments
2025-04-19 06:41:18,595 - INFO - Difficulty 138-139: 1 arguments
2025-04-19 06:41:18,595 - INFO - Difficulty 146-147: 1 arguments
2025-04-19 06:41:18,595 - INFO - Difficulty 150-151: 1 arguments
2025-04-19 06:41:18,595 - INFO - Difficulty 152-153: 1 arguments
2025-04-19 06:41:18,595 - INFO - Difficulty 153-154: 1 arguments
2025-04-19 06:41:18,595 - INFO - Difficulty 154-155: 1 arguments
2025-04-19 06:41:18,595 - INFO - Difficulty 155-156: 1 arguments
2025-04-19 06:41:18,595 - INFO - Difficulty 156-157: 1 arguments
2025-04-19 06:41:18,595 - INFO - Difficulty 158-159: 2 arguments
2025-04-19 06:41:18,596 - INFO - Difficulty 160-161: 2 arguments
2025-04-19 06:41:18,596 - INFO - Difficulty 161-162: 1 arguments
2025-04-19 06:41:18,596 - INFO - Difficulty 162-163: 2 arguments
2025-04-19 06:41:18,596 - INFO - Difficulty 168-169: 1 arguments
2025-04-19 06:41:18,596 - INFO - Difficulty 171-172: 1 arguments
2025-04-19 06:41:18,596 - INFO - Difficulty 173-174: 2 arguments
2025-04-19 06:41:18,596 - INFO - Difficulty 177-178: 1 arguments
2025-04-19 06:41:18,596 - INFO - Difficulty 178-179: 2 arguments
2025-04-19 06:41:18,596 - INFO - Difficulty 180-181: 1 arguments
2025-04-19 06:41:18,596 - INFO - Difficulty 181-182: 1 arguments
2025-04-19 06:41:18,596 - INFO - Difficulty 190-191: 2 arguments
2025-04-19 06:41:18,596 - INFO - Difficulty 191-192: 1 arguments
2025-04-19 06:41:18,596 - INFO - Difficulty 192-193: 2 arguments
2025-04-19 06:41:18,596 - INFO - Difficulty 193-194: 1 arguments
2025-04-19 06:41:18,596 - INFO - Difficulty 195-196: 3 arguments
2025-04-19 06:41:18,596 - INFO - Difficulty 196-197: 1 arguments
2025-04-19 06:41:18,596 - INFO - Difficulty 198-199: 1 arguments
2025-04-19 06:41:18,596 - INFO - Difficulty 199-200: 2 arguments
2025-04-19 06:41:18,597 - INFO - Difficulty 200-201: 1 arguments
2025-04-19 06:41:18,597 - INFO - Difficulty 201-202: 1 arguments
2025-04-19 06:41:18,597 - INFO - Difficulty 203-204: 1 arguments
2025-04-19 06:41:18,597 - INFO - Difficulty 204-205: 1 arguments
2025-04-19 06:41:18,597 - INFO - Difficulty 210-211: 1 arguments
2025-04-19 06:41:18,597 - INFO - Difficulty 211-212: 1 arguments
2025-04-19 06:41:18,597 - INFO - Difficulty 216-217: 1 arguments
2025-04-19 06:41:18,597 - INFO - Difficulty 220-221: 1 arguments
2025-04-19 06:41:18,597 - INFO - Difficulty 223-224: 1 arguments
2025-04-19 06:41:18,597 - INFO - Difficulty 226-227: 1 arguments
2025-04-19 06:41:18,597 - INFO - Difficulty 227-228: 1 arguments
2025-04-19 06:41:18,597 - INFO - Difficulty 236-237: 2 arguments
2025-04-19 06:41:18,597 - INFO - Difficulty 237-238: 2 arguments
2025-04-19 06:41:18,597 - INFO - Difficulty 250-251: 1 arguments
2025-04-19 06:41:18,597 - INFO - Difficulty 251-252: 1 arguments
2025-04-19 06:41:18,597 - INFO - Difficulty 252-253: 1 arguments
2025-04-19 06:41:18,597 - INFO - Difficulty 258-259: 1 arguments
2025-04-19 06:41:18,597 - INFO - Difficulty 259-260: 1 arguments
2025-04-19 06:41:18,597 - INFO - Difficulty 262-263: 2 arguments
2025-04-19 06:41:18,598 - INFO - Difficulty 272-273: 1 arguments
2025-04-19 06:41:18,598 - INFO - Difficulty 276-277: 1 arguments
2025-04-19 06:41:18,598 - INFO - Difficulty 278-279: 1 arguments
2025-04-19 06:41:18,598 - INFO - Difficulty 279-280: 1 arguments
2025-04-19 06:41:18,598 - INFO - Difficulty 280-281: 2 arguments
2025-04-19 06:41:18,598 - INFO - Difficulty 282-283: 1 arguments
2025-04-19 06:41:18,598 - INFO - Difficulty 283-284: 1 arguments
2025-04-19 06:41:18,598 - INFO - Difficulty 284-285: 1 arguments
2025-04-19 06:41:18,598 - INFO - Difficulty 285-286: 1 arguments
2025-04-19 06:41:18,598 - INFO - Difficulty 292-293: 1 arguments
2025-04-19 06:41:18,598 - INFO - Difficulty 299-300: 1 arguments
2025-04-19 06:41:18,598 - INFO - Difficulty 303-304: 1 arguments
2025-04-19 06:41:18,598 - INFO - Difficulty 306-307: 1 arguments
2025-04-19 06:41:18,598 - INFO - Difficulty 313-314: 1 arguments
2025-04-19 06:41:18,598 - INFO - Difficulty 321-322: 1 arguments
2025-04-19 06:41:18,598 - INFO - Difficulty 323-324: 1 arguments
2025-04-19 06:41:18,598 - INFO - Difficulty 337-338: 1 arguments
2025-04-19 06:41:18,598 - INFO - Difficulty 344-345: 1 arguments
2025-04-19 06:41:18,599 - INFO - Difficulty 348-349: 1 arguments
2025-04-19 06:41:18,599 - INFO - Difficulty 357-358: 1 arguments
2025-04-19 06:41:18,599 - INFO - Difficulty 361-362: 1 arguments
2025-04-19 06:41:18,599 - INFO - Difficulty 370-371: 1 arguments
2025-04-19 06:41:18,599 - INFO - Difficulty 371-372: 1 arguments
2025-04-19 06:41:18,599 - INFO - Difficulty 391-392: 1 arguments
2025-04-19 06:41:18,599 - INFO - Difficulty 396-397: 1 arguments
2025-04-19 06:41:18,599 - INFO - Difficulty 398-399: 2 arguments
2025-04-19 06:41:18,599 - INFO - Difficulty 399-400: 3 arguments
2025-04-19 06:41:18,599 - INFO - Difficulty 400-401: 1 arguments
2025-04-19 06:41:18,599 - INFO - Difficulty 409-410: 1 arguments
2025-04-19 06:41:18,599 - INFO - Difficulty 411-412: 1 arguments
2025-04-19 06:41:18,599 - INFO - Difficulty 414-415: 1 arguments
2025-04-19 06:41:18,599 - INFO - Difficulty 415-416: 1 arguments
2025-04-19 06:41:18,599 - INFO - Difficulty 419-420: 1 arguments
2025-04-19 06:41:18,599 - INFO - Difficulty 420-421: 1 arguments
2025-04-19 06:41:18,599 - INFO - Difficulty 421-422: 1 arguments
2025-04-19 06:41:18,599 - INFO - Difficulty 426-427: 1 arguments
2025-04-19 06:41:18,600 - INFO - Difficulty 435-436: 1 arguments
2025-04-19 06:41:18,600 - INFO - Difficulty 437-438: 1 arguments
2025-04-19 06:41:18,600 - INFO - Difficulty 444-445: 1 arguments
2025-04-19 06:41:18,600 - INFO - Difficulty 455-456: 1 arguments
2025-04-19 06:41:18,600 - INFO - Difficulty 456-457: 1 arguments
2025-04-19 06:41:18,600 - INFO - Difficulty 457-458: 1 arguments
2025-04-19 06:41:18,600 - INFO - Difficulty 461-462: 1 arguments
2025-04-19 06:41:18,600 - INFO - Difficulty 462-463: 1 arguments
2025-04-19 06:41:18,600 - INFO - Difficulty 465-466: 1 arguments
2025-04-19 06:41:18,600 - INFO - Difficulty 467-468: 1 arguments
2025-04-19 06:41:18,600 - INFO - Difficulty 468-469: 1 arguments
2025-04-19 06:41:18,600 - INFO - Difficulty 469-470: 1 arguments
2025-04-19 06:41:18,600 - INFO - Difficulty 470-471: 1 arguments
2025-04-19 06:41:18,600 - INFO - Difficulty 491-492: 1 arguments
2025-04-19 06:41:18,600 - INFO - Difficulty 502-503: 2 arguments
2025-04-19 06:41:18,600 - INFO - Difficulty 513-514: 1 arguments
2025-04-19 06:41:18,600 - INFO - === End Update ===

2025-04-19 06:41:18,600 - INFO - Restarting search...
2025-04-19 11:16:52,373 - INFO - 
=== Progress Update ===
2025-04-19 11:16:52,373 - INFO - Processed premises: 3000/10000
2025-04-19 11:16:52,373 - INFO - Total elapsed time: 43027.74 seconds
2025-04-19 11:16:52,374 - INFO - Time since last save: 16533.78 seconds
2025-04-19 11:16:52,374 - INFO - Valid arguments found: 440
2025-04-19 11:16:52,374 - INFO - Invalid arguments found: 4888
2025-04-19 11:16:52,374 - INFO - Average time per premise: 14.34 seconds
2025-04-19 11:16:52,374 - INFO - 
Difficulty Distribution:
2025-04-19 11:16:52,374 - INFO - Difficulty 15-16: 2 arguments
2025-04-19 11:16:52,374 - INFO - Difficulty 16-17: 1 arguments
2025-04-19 11:16:52,374 - INFO - Difficulty 17-18: 2 arguments
2025-04-19 11:16:52,374 - INFO - Difficulty 18-19: 9 arguments
2025-04-19 11:16:52,374 - INFO - Difficulty 19-20: 4 arguments
2025-04-19 11:16:52,374 - INFO - Difficulty 20-21: 6 arguments
2025-04-19 11:16:52,374 - INFO - Difficulty 21-22: 7 arguments
2025-04-19 11:16:52,374 - INFO - Difficulty 22-23: 5 arguments
2025-04-19 11:16:52,374 - INFO - Difficulty 23-24: 16 arguments
2025-04-19 11:16:52,375 - INFO - Difficulty 24-25: 8 arguments
2025-04-19 11:16:52,375 - INFO - Difficulty 25-26: 10 arguments
2025-04-19 11:16:52,375 - INFO - Difficulty 26-27: 6 arguments
2025-04-19 11:16:52,375 - INFO - Difficulty 27-28: 11 arguments
2025-04-19 11:16:52,375 - INFO - Difficulty 28-29: 4 arguments
2025-04-19 11:16:52,375 - INFO - Difficulty 29-30: 2 arguments
2025-04-19 11:16:52,375 - INFO - Difficulty 30-31: 1 arguments
2025-04-19 11:16:52,375 - INFO - Difficulty 31-32: 6 arguments
2025-04-19 11:16:52,375 - INFO - Difficulty 32-33: 5 arguments
2025-04-19 11:16:52,375 - INFO - Difficulty 33-34: 4 arguments
2025-04-19 11:16:52,375 - INFO - Difficulty 34-35: 2 arguments
2025-04-19 11:16:52,375 - INFO - Difficulty 35-36: 4 arguments
2025-04-19 11:16:52,375 - INFO - Difficulty 36-37: 3 arguments
2025-04-19 11:16:52,375 - INFO - Difficulty 37-38: 3 arguments
2025-04-19 11:16:52,375 - INFO - Difficulty 38-39: 4 arguments
2025-04-19 11:16:52,375 - INFO - Difficulty 39-40: 5 arguments
2025-04-19 11:16:52,375 - INFO - Difficulty 40-41: 7 arguments
2025-04-19 11:16:52,376 - INFO - Difficulty 41-42: 3 arguments
2025-04-19 11:16:52,376 - INFO - Difficulty 42-43: 2 arguments
2025-04-19 11:16:52,376 - INFO - Difficulty 43-44: 2 arguments
2025-04-19 11:16:52,376 - INFO - Difficulty 44-45: 4 arguments
2025-04-19 11:16:52,376 - INFO - Difficulty 45-46: 3 arguments
2025-04-19 11:16:52,376 - INFO - Difficulty 46-47: 7 arguments
2025-04-19 11:16:52,376 - INFO - Difficulty 47-48: 6 arguments
2025-04-19 11:16:52,376 - INFO - Difficulty 48-49: 2 arguments
2025-04-19 11:16:52,376 - INFO - Difficulty 49-50: 3 arguments
2025-04-19 11:16:52,376 - INFO - Difficulty 50-51: 3 arguments
2025-04-19 11:16:52,376 - INFO - Difficulty 51-52: 2 arguments
2025-04-19 11:16:52,376 - INFO - Difficulty 52-53: 1 arguments
2025-04-19 11:16:52,376 - INFO - Difficulty 53-54: 4 arguments
2025-04-19 11:16:52,376 - INFO - Difficulty 54-55: 5 arguments
2025-04-19 11:16:52,376 - INFO - Difficulty 55-56: 1 arguments
2025-04-19 11:16:52,376 - INFO - Difficulty 56-57: 6 arguments
2025-04-19 11:16:52,376 - INFO - Difficulty 58-59: 3 arguments
2025-04-19 11:16:52,376 - INFO - Difficulty 59-60: 3 arguments
2025-04-19 11:16:52,376 - INFO - Difficulty 60-61: 2 arguments
2025-04-19 11:16:52,377 - INFO - Difficulty 61-62: 5 arguments
2025-04-19 11:16:52,377 - INFO - Difficulty 62-63: 4 arguments
2025-04-19 11:16:52,377 - INFO - Difficulty 63-64: 1 arguments
2025-04-19 11:16:52,377 - INFO - Difficulty 64-65: 2 arguments
2025-04-19 11:16:52,377 - INFO - Difficulty 65-66: 2 arguments
2025-04-19 11:16:52,377 - INFO - Difficulty 66-67: 2 arguments
2025-04-19 11:16:52,377 - INFO - Difficulty 67-68: 6 arguments
2025-04-19 11:16:52,377 - INFO - Difficulty 69-70: 8 arguments
2025-04-19 11:16:52,377 - INFO - Difficulty 70-71: 7 arguments
2025-04-19 11:16:52,377 - INFO - Difficulty 71-72: 4 arguments
2025-04-19 11:16:52,377 - INFO - Difficulty 72-73: 3 arguments
2025-04-19 11:16:52,377 - INFO - Difficulty 73-74: 3 arguments
2025-04-19 11:16:52,377 - INFO - Difficulty 74-75: 3 arguments
2025-04-19 11:16:52,377 - INFO - Difficulty 75-76: 2 arguments
2025-04-19 11:16:52,377 - INFO - Difficulty 76-77: 6 arguments
2025-04-19 11:16:52,377 - INFO - Difficulty 77-78: 4 arguments
2025-04-19 11:16:52,377 - INFO - Difficulty 79-80: 2 arguments
2025-04-19 11:16:52,378 - INFO - Difficulty 80-81: 2 arguments
2025-04-19 11:16:52,378 - INFO - Difficulty 81-82: 4 arguments
2025-04-19 11:16:52,378 - INFO - Difficulty 82-83: 3 arguments
2025-04-19 11:16:52,378 - INFO - Difficulty 83-84: 2 arguments
2025-04-19 11:16:52,378 - INFO - Difficulty 84-85: 1 arguments
2025-04-19 11:16:52,378 - INFO - Difficulty 85-86: 2 arguments
2025-04-19 11:16:52,378 - INFO - Difficulty 86-87: 3 arguments
2025-04-19 11:16:52,378 - INFO - Difficulty 87-88: 4 arguments
2025-04-19 11:16:52,378 - INFO - Difficulty 90-91: 1 arguments
2025-04-19 11:16:52,378 - INFO - Difficulty 91-92: 1 arguments
2025-04-19 11:16:52,378 - INFO - Difficulty 92-93: 2 arguments
2025-04-19 11:16:52,379 - INFO - Difficulty 93-94: 2 arguments
2025-04-19 11:16:52,379 - INFO - Difficulty 95-96: 1 arguments
2025-04-19 11:16:52,379 - INFO - Difficulty 97-98: 1 arguments
2025-04-19 11:16:52,379 - INFO - Difficulty 98-99: 3 arguments
2025-04-19 11:16:52,379 - INFO - Difficulty 99-100: 2 arguments
2025-04-19 11:16:52,379 - INFO - Difficulty 102-103: 1 arguments
2025-04-19 11:16:52,379 - INFO - Difficulty 103-104: 2 arguments
2025-04-19 11:16:52,379 - INFO - Difficulty 104-105: 1 arguments
2025-04-19 11:16:52,379 - INFO - Difficulty 105-106: 2 arguments
2025-04-19 11:16:52,379 - INFO - Difficulty 106-107: 1 arguments
2025-04-19 11:16:52,379 - INFO - Difficulty 107-108: 1 arguments
2025-04-19 11:16:52,379 - INFO - Difficulty 108-109: 2 arguments
2025-04-19 11:16:52,379 - INFO - Difficulty 109-110: 2 arguments
2025-04-19 11:16:52,380 - INFO - Difficulty 110-111: 2 arguments
2025-04-19 11:16:52,380 - INFO - Difficulty 111-112: 1 arguments
2025-04-19 11:16:52,380 - INFO - Difficulty 112-113: 3 arguments
2025-04-19 11:16:52,380 - INFO - Difficulty 116-117: 1 arguments
2025-04-19 11:16:52,380 - INFO - Difficulty 117-118: 1 arguments
2025-04-19 11:16:52,380 - INFO - Difficulty 118-119: 2 arguments
2025-04-19 11:16:52,380 - INFO - Difficulty 122-123: 1 arguments
2025-04-19 11:16:52,380 - INFO - Difficulty 124-125: 1 arguments
2025-04-19 11:16:52,380 - INFO - Difficulty 125-126: 1 arguments
2025-04-19 11:16:52,380 - INFO - Difficulty 132-133: 1 arguments
2025-04-19 11:16:52,380 - INFO - Difficulty 136-137: 1 arguments
2025-04-19 11:16:52,380 - INFO - Difficulty 138-139: 1 arguments
2025-04-19 11:16:52,380 - INFO - Difficulty 146-147: 1 arguments
2025-04-19 11:16:52,380 - INFO - Difficulty 150-151: 1 arguments
2025-04-19 11:16:52,380 - INFO - Difficulty 152-153: 1 arguments
2025-04-19 11:16:52,380 - INFO - Difficulty 153-154: 1 arguments
2025-04-19 11:16:52,380 - INFO - Difficulty 154-155: 1 arguments
2025-04-19 11:16:52,380 - INFO - Difficulty 155-156: 1 arguments
2025-04-19 11:16:52,381 - INFO - Difficulty 156-157: 1 arguments
2025-04-19 11:16:52,381 - INFO - Difficulty 158-159: 2 arguments
2025-04-19 11:16:52,381 - INFO - Difficulty 160-161: 2 arguments
2025-04-19 11:16:52,381 - INFO - Difficulty 161-162: 1 arguments
2025-04-19 11:16:52,381 - INFO - Difficulty 162-163: 2 arguments
2025-04-19 11:16:52,381 - INFO - Difficulty 168-169: 1 arguments
2025-04-19 11:16:52,381 - INFO - Difficulty 171-172: 1 arguments
2025-04-19 11:16:52,381 - INFO - Difficulty 173-174: 2 arguments
2025-04-19 11:16:52,381 - INFO - Difficulty 177-178: 1 arguments
2025-04-19 11:16:52,381 - INFO - Difficulty 178-179: 2 arguments
2025-04-19 11:16:52,381 - INFO - Difficulty 180-181: 1 arguments
2025-04-19 11:16:52,381 - INFO - Difficulty 181-182: 1 arguments
2025-04-19 11:16:52,381 - INFO - Difficulty 190-191: 2 arguments
2025-04-19 11:16:52,381 - INFO - Difficulty 191-192: 1 arguments
2025-04-19 11:16:52,381 - INFO - Difficulty 192-193: 2 arguments
2025-04-19 11:16:52,381 - INFO - Difficulty 193-194: 1 arguments
2025-04-19 11:16:52,382 - INFO - Difficulty 195-196: 3 arguments
2025-04-19 11:16:52,382 - INFO - Difficulty 196-197: 1 arguments
2025-04-19 11:16:52,382 - INFO - Difficulty 198-199: 1 arguments
2025-04-19 11:16:52,382 - INFO - Difficulty 199-200: 2 arguments
2025-04-19 11:16:52,382 - INFO - Difficulty 200-201: 1 arguments
2025-04-19 11:16:52,382 - INFO - Difficulty 201-202: 1 arguments
2025-04-19 11:16:52,382 - INFO - Difficulty 203-204: 1 arguments
2025-04-19 11:16:52,382 - INFO - Difficulty 204-205: 1 arguments
2025-04-19 11:16:52,382 - INFO - Difficulty 210-211: 1 arguments
2025-04-19 11:16:52,382 - INFO - Difficulty 211-212: 1 arguments
2025-04-19 11:16:52,382 - INFO - Difficulty 216-217: 1 arguments
2025-04-19 11:16:52,382 - INFO - Difficulty 220-221: 1 arguments
2025-04-19 11:16:52,382 - INFO - Difficulty 223-224: 1 arguments
2025-04-19 11:16:52,382 - INFO - Difficulty 226-227: 1 arguments
2025-04-19 11:16:52,382 - INFO - Difficulty 227-228: 1 arguments
2025-04-19 11:16:52,382 - INFO - Difficulty 236-237: 2 arguments
2025-04-19 11:16:52,382 - INFO - Difficulty 237-238: 2 arguments
2025-04-19 11:16:52,382 - INFO - Difficulty 250-251: 1 arguments
2025-04-19 11:16:52,383 - INFO - Difficulty 251-252: 1 arguments
2025-04-19 11:16:52,383 - INFO - Difficulty 252-253: 1 arguments
2025-04-19 11:16:52,383 - INFO - Difficulty 258-259: 1 arguments
2025-04-19 11:16:52,383 - INFO - Difficulty 259-260: 1 arguments
2025-04-19 11:16:52,383 - INFO - Difficulty 262-263: 2 arguments
2025-04-19 11:16:52,383 - INFO - Difficulty 272-273: 1 arguments
2025-04-19 11:16:52,383 - INFO - Difficulty 276-277: 1 arguments
2025-04-19 11:16:52,383 - INFO - Difficulty 278-279: 1 arguments
2025-04-19 11:16:52,383 - INFO - Difficulty 279-280: 1 arguments
2025-04-19 11:16:52,383 - INFO - Difficulty 280-281: 2 arguments
2025-04-19 11:16:52,383 - INFO - Difficulty 282-283: 1 arguments
2025-04-19 11:16:52,383 - INFO - Difficulty 283-284: 1 arguments
2025-04-19 11:16:52,383 - INFO - Difficulty 284-285: 1 arguments
2025-04-19 11:16:52,383 - INFO - Difficulty 285-286: 1 arguments
2025-04-19 11:16:52,383 - INFO - Difficulty 292-293: 1 arguments
2025-04-19 11:16:52,383 - INFO - Difficulty 299-300: 1 arguments
2025-04-19 11:16:52,383 - INFO - Difficulty 303-304: 1 arguments
2025-04-19 11:16:52,383 - INFO - Difficulty 306-307: 1 arguments
2025-04-19 11:16:52,383 - INFO - Difficulty 313-314: 1 arguments
2025-04-19 11:16:52,384 - INFO - Difficulty 321-322: 1 arguments
2025-04-19 11:16:52,384 - INFO - Difficulty 323-324: 1 arguments
2025-04-19 11:16:52,384 - INFO - Difficulty 337-338: 1 arguments
2025-04-19 11:16:52,384 - INFO - Difficulty 344-345: 1 arguments
2025-04-19 11:16:52,384 - INFO - Difficulty 348-349: 1 arguments
2025-04-19 11:16:52,384 - INFO - Difficulty 357-358: 1 arguments
2025-04-19 11:16:52,384 - INFO - Difficulty 361-362: 1 arguments
2025-04-19 11:16:52,384 - INFO - Difficulty 370-371: 1 arguments
2025-04-19 11:16:52,384 - INFO - Difficulty 371-372: 1 arguments
2025-04-19 11:16:52,384 - INFO - Difficulty 391-392: 1 arguments
2025-04-19 11:16:52,384 - INFO - Difficulty 396-397: 1 arguments
2025-04-19 11:16:52,384 - INFO - Difficulty 398-399: 2 arguments
2025-04-19 11:16:52,384 - INFO - Difficulty 399-400: 3 arguments
2025-04-19 11:16:52,384 - INFO - Difficulty 400-401: 1 arguments
2025-04-19 11:16:52,384 - INFO - Difficulty 409-410: 1 arguments
2025-04-19 11:16:52,384 - INFO - Difficulty 411-412: 1 arguments
2025-04-19 11:16:52,384 - INFO - Difficulty 414-415: 1 arguments
2025-04-19 11:16:52,384 - INFO - Difficulty 415-416: 1 arguments
2025-04-19 11:16:52,385 - INFO - Difficulty 419-420: 1 arguments
2025-04-19 11:16:52,385 - INFO - Difficulty 420-421: 1 arguments
2025-04-19 11:16:52,385 - INFO - Difficulty 421-422: 1 arguments
2025-04-19 11:16:52,385 - INFO - Difficulty 426-427: 1 arguments
2025-04-19 11:16:52,385 - INFO - Difficulty 435-436: 1 arguments
2025-04-19 11:16:52,385 - INFO - Difficulty 437-438: 1 arguments
2025-04-19 11:16:52,385 - INFO - Difficulty 444-445: 1 arguments
2025-04-19 11:16:52,385 - INFO - Difficulty 455-456: 1 arguments
2025-04-19 11:16:52,385 - INFO - Difficulty 456-457: 1 arguments
2025-04-19 11:16:52,385 - INFO - Difficulty 457-458: 1 arguments
2025-04-19 11:16:52,385 - INFO - Difficulty 461-462: 1 arguments
2025-04-19 11:16:52,385 - INFO - Difficulty 462-463: 1 arguments
2025-04-19 11:16:52,385 - INFO - Difficulty 465-466: 1 arguments
2025-04-19 11:16:52,386 - INFO - Difficulty 467-468: 1 arguments
2025-04-19 11:16:52,386 - INFO - Difficulty 468-469: 1 arguments
2025-04-19 11:16:52,386 - INFO - Difficulty 469-470: 1 arguments
2025-04-19 11:16:52,386 - INFO - Difficulty 470-471: 1 arguments
2025-04-19 11:16:52,386 - INFO - Difficulty 491-492: 1 arguments
2025-04-19 11:16:52,386 - INFO - Difficulty 502-503: 2 arguments
2025-04-19 11:16:52,386 - INFO - Difficulty 513-514: 1 arguments
2025-04-19 11:16:52,386 - INFO - === End Update ===

2025-04-19 11:16:52,386 - INFO - Restarting search...
2025-04-19 15:17:12,893 - INFO - 
=== Progress Update ===
2025-04-19 15:17:12,894 - INFO - Processed premises: 4000/10000
2025-04-19 15:17:12,894 - INFO - Total elapsed time: 57448.26 seconds
2025-04-19 15:17:12,894 - INFO - Time since last save: 14420.52 seconds
2025-04-19 15:17:12,894 - INFO - Valid arguments found: 440
2025-04-19 15:17:12,894 - INFO - Invalid arguments found: 4888
2025-04-19 15:17:12,895 - INFO - Average time per premise: 14.36 seconds
2025-04-19 15:17:12,895 - INFO - 
Difficulty Distribution:
2025-04-19 15:17:12,895 - INFO - Difficulty 15-16: 2 arguments
2025-04-19 15:17:12,895 - INFO - Difficulty 16-17: 1 arguments
2025-04-19 15:17:12,895 - INFO - Difficulty 17-18: 2 arguments
2025-04-19 15:17:12,895 - INFO - Difficulty 18-19: 9 arguments
2025-04-19 15:17:12,895 - INFO - Difficulty 19-20: 4 arguments
2025-04-19 15:17:12,895 - INFO - Difficulty 20-21: 6 arguments
2025-04-19 15:17:12,895 - INFO - Difficulty 21-22: 7 arguments
2025-04-19 15:17:12,895 - INFO - Difficulty 22-23: 5 arguments
2025-04-19 15:17:12,895 - INFO - Difficulty 23-24: 16 arguments
2025-04-19 15:17:12,896 - INFO - Difficulty 24-25: 8 arguments
2025-04-19 15:17:12,896 - INFO - Difficulty 25-26: 10 arguments
2025-04-19 15:17:12,896 - INFO - Difficulty 26-27: 6 arguments
2025-04-19 15:17:12,896 - INFO - Difficulty 27-28: 11 arguments
2025-04-19 15:17:12,896 - INFO - Difficulty 28-29: 4 arguments
2025-04-19 15:17:12,896 - INFO - Difficulty 29-30: 2 arguments
2025-04-19 15:17:12,896 - INFO - Difficulty 30-31: 1 arguments
2025-04-19 15:17:12,896 - INFO - Difficulty 31-32: 6 arguments
2025-04-19 15:17:12,896 - INFO - Difficulty 32-33: 5 arguments
2025-04-19 15:17:12,896 - INFO - Difficulty 33-34: 4 arguments
2025-04-19 15:17:12,896 - INFO - Difficulty 34-35: 2 arguments
2025-04-19 15:17:12,896 - INFO - Difficulty 35-36: 4 arguments
2025-04-19 15:17:12,896 - INFO - Difficulty 36-37: 3 arguments
2025-04-19 15:17:12,896 - INFO - Difficulty 37-38: 3 arguments
2025-04-19 15:17:12,897 - INFO - Difficulty 38-39: 4 arguments
2025-04-19 15:17:12,897 - INFO - Difficulty 39-40: 5 arguments
2025-04-19 15:17:12,897 - INFO - Difficulty 40-41: 7 arguments
2025-04-19 15:17:12,897 - INFO - Difficulty 41-42: 3 arguments
2025-04-19 15:17:12,897 - INFO - Difficulty 42-43: 2 arguments
2025-04-19 15:17:12,897 - INFO - Difficulty 43-44: 2 arguments
2025-04-19 15:17:12,897 - INFO - Difficulty 44-45: 4 arguments
2025-04-19 15:17:12,897 - INFO - Difficulty 45-46: 3 arguments
2025-04-19 15:17:12,897 - INFO - Difficulty 46-47: 7 arguments
2025-04-19 15:17:12,897 - INFO - Difficulty 47-48: 6 arguments
2025-04-19 15:17:12,897 - INFO - Difficulty 48-49: 2 arguments
2025-04-19 15:17:12,897 - INFO - Difficulty 49-50: 3 arguments
2025-04-19 15:17:12,897 - INFO - Difficulty 50-51: 3 arguments
2025-04-19 15:17:12,897 - INFO - Difficulty 51-52: 2 arguments
2025-04-19 15:17:12,897 - INFO - Difficulty 52-53: 1 arguments
2025-04-19 15:17:12,898 - INFO - Difficulty 53-54: 4 arguments
2025-04-19 15:17:12,898 - INFO - Difficulty 54-55: 5 arguments
2025-04-19 15:17:12,898 - INFO - Difficulty 55-56: 1 arguments
2025-04-19 15:17:12,898 - INFO - Difficulty 56-57: 6 arguments
2025-04-19 15:17:12,898 - INFO - Difficulty 58-59: 3 arguments
2025-04-19 15:17:12,898 - INFO - Difficulty 59-60: 3 arguments
2025-04-19 15:17:12,898 - INFO - Difficulty 60-61: 2 arguments
2025-04-19 15:17:12,898 - INFO - Difficulty 61-62: 5 arguments
2025-04-19 15:17:12,898 - INFO - Difficulty 62-63: 4 arguments
2025-04-19 15:17:12,898 - INFO - Difficulty 63-64: 1 arguments
2025-04-19 15:17:12,898 - INFO - Difficulty 64-65: 2 arguments
2025-04-19 15:17:12,898 - INFO - Difficulty 65-66: 2 arguments
2025-04-19 15:17:12,898 - INFO - Difficulty 66-67: 2 arguments
2025-04-19 15:17:12,898 - INFO - Difficulty 67-68: 6 arguments
2025-04-19 15:17:12,898 - INFO - Difficulty 69-70: 8 arguments
2025-04-19 15:17:12,898 - INFO - Difficulty 70-71: 7 arguments
2025-04-19 15:17:12,898 - INFO - Difficulty 71-72: 4 arguments
2025-04-19 15:17:12,899 - INFO - Difficulty 72-73: 3 arguments
2025-04-19 15:17:12,899 - INFO - Difficulty 73-74: 3 arguments
2025-04-19 15:17:12,899 - INFO - Difficulty 74-75: 3 arguments
2025-04-19 15:17:12,899 - INFO - Difficulty 75-76: 2 arguments
2025-04-19 15:17:12,899 - INFO - Difficulty 76-77: 6 arguments
2025-04-19 15:17:12,899 - INFO - Difficulty 77-78: 4 arguments
2025-04-19 15:17:12,899 - INFO - Difficulty 79-80: 2 arguments
2025-04-19 15:17:12,899 - INFO - Difficulty 80-81: 2 arguments
2025-04-19 15:17:12,899 - INFO - Difficulty 81-82: 4 arguments
2025-04-19 15:17:12,899 - INFO - Difficulty 82-83: 3 arguments
2025-04-19 15:17:12,899 - INFO - Difficulty 83-84: 2 arguments
2025-04-19 15:17:12,899 - INFO - Difficulty 84-85: 1 arguments
2025-04-19 15:17:12,899 - INFO - Difficulty 85-86: 2 arguments
2025-04-19 15:17:12,899 - INFO - Difficulty 86-87: 3 arguments
2025-04-19 15:17:12,899 - INFO - Difficulty 87-88: 4 arguments
2025-04-19 15:17:12,899 - INFO - Difficulty 90-91: 1 arguments
2025-04-19 15:17:12,899 - INFO - Difficulty 91-92: 1 arguments
2025-04-19 15:17:12,900 - INFO - Difficulty 92-93: 2 arguments
2025-04-19 15:17:12,900 - INFO - Difficulty 93-94: 2 arguments
2025-04-19 15:17:12,900 - INFO - Difficulty 95-96: 1 arguments
2025-04-19 15:17:12,900 - INFO - Difficulty 97-98: 1 arguments
2025-04-19 15:17:12,900 - INFO - Difficulty 98-99: 3 arguments
2025-04-19 15:17:12,900 - INFO - Difficulty 99-100: 2 arguments
2025-04-19 15:17:12,900 - INFO - Difficulty 102-103: 1 arguments
2025-04-19 15:17:12,900 - INFO - Difficulty 103-104: 2 arguments
2025-04-19 15:17:12,900 - INFO - Difficulty 104-105: 1 arguments
2025-04-19 15:17:12,900 - INFO - Difficulty 105-106: 2 arguments
2025-04-19 15:17:12,900 - INFO - Difficulty 106-107: 1 arguments
2025-04-19 15:17:12,900 - INFO - Difficulty 107-108: 1 arguments
2025-04-19 15:17:12,900 - INFO - Difficulty 108-109: 2 arguments
2025-04-19 15:17:12,900 - INFO - Difficulty 109-110: 2 arguments
2025-04-19 15:17:12,900 - INFO - Difficulty 110-111: 2 arguments
2025-04-19 15:17:12,900 - INFO - Difficulty 111-112: 1 arguments
2025-04-19 15:17:12,900 - INFO - Difficulty 112-113: 3 arguments
2025-04-19 15:17:12,901 - INFO - Difficulty 116-117: 1 arguments
2025-04-19 15:17:12,901 - INFO - Difficulty 117-118: 1 arguments
2025-04-19 15:17:12,901 - INFO - Difficulty 118-119: 2 arguments
2025-04-19 15:17:12,901 - INFO - Difficulty 122-123: 1 arguments
2025-04-19 15:17:12,901 - INFO - Difficulty 124-125: 1 arguments
2025-04-19 15:17:12,901 - INFO - Difficulty 125-126: 1 arguments
2025-04-19 15:17:12,901 - INFO - Difficulty 132-133: 1 arguments
2025-04-19 15:17:12,901 - INFO - Difficulty 136-137: 1 arguments
2025-04-19 15:17:12,901 - INFO - Difficulty 138-139: 1 arguments
2025-04-19 15:17:12,901 - INFO - Difficulty 146-147: 1 arguments
2025-04-19 15:17:12,901 - INFO - Difficulty 150-151: 1 arguments
2025-04-19 15:17:12,901 - INFO - Difficulty 152-153: 1 arguments
2025-04-19 15:17:12,901 - INFO - Difficulty 153-154: 1 arguments
2025-04-19 15:17:12,901 - INFO - Difficulty 154-155: 1 arguments
2025-04-19 15:17:12,901 - INFO - Difficulty 155-156: 1 arguments
2025-04-19 15:17:12,901 - INFO - Difficulty 156-157: 1 arguments
2025-04-19 15:17:12,902 - INFO - Difficulty 158-159: 2 arguments
2025-04-19 15:17:12,902 - INFO - Difficulty 160-161: 2 arguments
2025-04-19 15:17:12,902 - INFO - Difficulty 161-162: 1 arguments
2025-04-19 15:17:12,902 - INFO - Difficulty 162-163: 2 arguments
2025-04-19 15:17:12,902 - INFO - Difficulty 168-169: 1 arguments
2025-04-19 15:17:12,902 - INFO - Difficulty 171-172: 1 arguments
2025-04-19 15:17:12,902 - INFO - Difficulty 173-174: 2 arguments
2025-04-19 15:17:12,902 - INFO - Difficulty 177-178: 1 arguments
2025-04-19 15:17:12,902 - INFO - Difficulty 178-179: 2 arguments
2025-04-19 15:17:12,902 - INFO - Difficulty 180-181: 1 arguments
2025-04-19 15:17:12,902 - INFO - Difficulty 181-182: 1 arguments
2025-04-19 15:17:12,902 - INFO - Difficulty 190-191: 2 arguments
2025-04-19 15:17:12,902 - INFO - Difficulty 191-192: 1 arguments
2025-04-19 15:17:12,902 - INFO - Difficulty 192-193: 2 arguments
2025-04-19 15:17:12,902 - INFO - Difficulty 193-194: 1 arguments
2025-04-19 15:17:12,902 - INFO - Difficulty 195-196: 3 arguments
2025-04-19 15:17:12,902 - INFO - Difficulty 196-197: 1 arguments
2025-04-19 15:17:12,902 - INFO - Difficulty 198-199: 1 arguments
2025-04-19 15:17:12,902 - INFO - Difficulty 199-200: 2 arguments
2025-04-19 15:17:12,903 - INFO - Difficulty 200-201: 1 arguments
2025-04-19 15:17:12,903 - INFO - Difficulty 201-202: 1 arguments
2025-04-19 15:17:12,903 - INFO - Difficulty 203-204: 1 arguments
2025-04-19 15:17:12,903 - INFO - Difficulty 204-205: 1 arguments
2025-04-19 15:17:12,903 - INFO - Difficulty 210-211: 1 arguments
2025-04-19 15:17:12,903 - INFO - Difficulty 211-212: 1 arguments
2025-04-19 15:17:12,903 - INFO - Difficulty 216-217: 1 arguments
2025-04-19 15:17:12,903 - INFO - Difficulty 220-221: 1 arguments
2025-04-19 15:17:12,903 - INFO - Difficulty 223-224: 1 arguments
2025-04-19 15:17:12,903 - INFO - Difficulty 226-227: 1 arguments
2025-04-19 15:17:12,903 - INFO - Difficulty 227-228: 1 arguments
2025-04-19 15:17:12,903 - INFO - Difficulty 236-237: 2 arguments
2025-04-19 15:17:12,903 - INFO - Difficulty 237-238: 2 arguments
2025-04-19 15:17:12,903 - INFO - Difficulty 250-251: 1 arguments
2025-04-19 15:17:12,903 - INFO - Difficulty 251-252: 1 arguments
2025-04-19 15:17:12,903 - INFO - Difficulty 252-253: 1 arguments
2025-04-19 15:17:12,903 - INFO - Difficulty 258-259: 1 arguments
2025-04-19 15:17:12,903 - INFO - Difficulty 259-260: 1 arguments
2025-04-19 15:17:12,903 - INFO - Difficulty 262-263: 2 arguments
2025-04-19 15:17:12,904 - INFO - Difficulty 272-273: 1 arguments
2025-04-19 15:17:12,904 - INFO - Difficulty 276-277: 1 arguments
2025-04-19 15:17:12,904 - INFO - Difficulty 278-279: 1 arguments
2025-04-19 15:17:12,904 - INFO - Difficulty 279-280: 1 arguments
2025-04-19 15:17:12,904 - INFO - Difficulty 280-281: 2 arguments
2025-04-19 15:17:12,904 - INFO - Difficulty 282-283: 1 arguments
2025-04-19 15:17:12,904 - INFO - Difficulty 283-284: 1 arguments
2025-04-19 15:17:12,904 - INFO - Difficulty 284-285: 1 arguments
2025-04-19 15:17:12,904 - INFO - Difficulty 285-286: 1 arguments
2025-04-19 15:17:12,904 - INFO - Difficulty 292-293: 1 arguments
2025-04-19 15:17:12,904 - INFO - Difficulty 299-300: 1 arguments
2025-04-19 15:17:12,904 - INFO - Difficulty 303-304: 1 arguments
2025-04-19 15:17:12,904 - INFO - Difficulty 306-307: 1 arguments
2025-04-19 15:17:12,904 - INFO - Difficulty 313-314: 1 arguments
2025-04-19 15:17:12,904 - INFO - Difficulty 321-322: 1 arguments
2025-04-19 15:17:12,904 - INFO - Difficulty 323-324: 1 arguments
2025-04-19 15:17:12,904 - INFO - Difficulty 337-338: 1 arguments
2025-04-19 15:17:12,904 - INFO - Difficulty 344-345: 1 arguments
2025-04-19 15:17:12,904 - INFO - Difficulty 348-349: 1 arguments
2025-04-19 15:17:12,904 - INFO - Difficulty 357-358: 1 arguments
2025-04-19 15:17:12,905 - INFO - Difficulty 361-362: 1 arguments
2025-04-19 15:17:12,905 - INFO - Difficulty 370-371: 1 arguments
2025-04-19 15:17:12,905 - INFO - Difficulty 371-372: 1 arguments
2025-04-19 15:17:12,905 - INFO - Difficulty 391-392: 1 arguments
2025-04-19 15:17:12,905 - INFO - Difficulty 396-397: 1 arguments
2025-04-19 15:17:12,905 - INFO - Difficulty 398-399: 2 arguments
2025-04-19 15:17:12,905 - INFO - Difficulty 399-400: 3 arguments
2025-04-19 15:17:12,905 - INFO - Difficulty 400-401: 1 arguments
2025-04-19 15:17:12,905 - INFO - Difficulty 409-410: 1 arguments
2025-04-19 15:17:12,905 - INFO - Difficulty 411-412: 1 arguments
2025-04-19 15:17:12,905 - INFO - Difficulty 414-415: 1 arguments
2025-04-19 15:17:12,905 - INFO - Difficulty 415-416: 1 arguments
2025-04-19 15:17:12,905 - INFO - Difficulty 419-420: 1 arguments
2025-04-19 15:17:12,905 - INFO - Difficulty 420-421: 1 arguments
2025-04-19 15:17:12,905 - INFO - Difficulty 421-422: 1 arguments
2025-04-19 15:17:12,905 - INFO - Difficulty 426-427: 1 arguments
2025-04-19 15:17:12,905 - INFO - Difficulty 435-436: 1 arguments
2025-04-19 15:17:12,905 - INFO - Difficulty 437-438: 1 arguments
2025-04-19 15:17:12,905 - INFO - Difficulty 444-445: 1 arguments
2025-04-19 15:17:12,906 - INFO - Difficulty 455-456: 1 arguments
2025-04-19 15:17:12,906 - INFO - Difficulty 456-457: 1 arguments
2025-04-19 15:17:12,906 - INFO - Difficulty 457-458: 1 arguments
2025-04-19 15:17:12,906 - INFO - Difficulty 461-462: 1 arguments
2025-04-19 15:17:12,906 - INFO - Difficulty 462-463: 1 arguments
2025-04-19 15:17:12,906 - INFO - Difficulty 465-466: 1 arguments
2025-04-19 15:17:12,906 - INFO - Difficulty 467-468: 1 arguments
2025-04-19 15:17:12,906 - INFO - Difficulty 468-469: 1 arguments
2025-04-19 15:17:12,906 - INFO - Difficulty 469-470: 1 arguments
2025-04-19 15:17:12,906 - INFO - Difficulty 470-471: 1 arguments
2025-04-19 15:17:12,906 - INFO - Difficulty 491-492: 1 arguments
2025-04-19 15:17:12,906 - INFO - Difficulty 502-503: 2 arguments
2025-04-19 15:17:12,906 - INFO - Difficulty 513-514: 1 arguments
2025-04-19 15:17:12,906 - INFO - === End Update ===

2025-04-19 15:17:12,906 - INFO - Restarting search...
2025-04-19 19:28:08,734 - INFO - 
=== Progress Update ===
2025-04-19 19:28:08,735 - INFO - Processed premises: 5000/10000
2025-04-19 19:28:08,735 - INFO - Total elapsed time: 72504.11 seconds
2025-04-19 19:28:08,735 - INFO - Time since last save: 15055.84 seconds
2025-04-19 19:28:08,735 - INFO - Valid arguments found: 440
2025-04-19 19:28:08,735 - INFO - Invalid arguments found: 4888
2025-04-19 19:28:08,735 - INFO - Average time per premise: 14.50 seconds
2025-04-19 19:28:08,735 - INFO - 
Difficulty Distribution:
2025-04-19 19:28:08,735 - INFO - Difficulty 15-16: 2 arguments
2025-04-19 19:28:08,735 - INFO - Difficulty 16-17: 1 arguments
2025-04-19 19:28:08,735 - INFO - Difficulty 17-18: 2 arguments
2025-04-19 19:28:08,735 - INFO - Difficulty 18-19: 9 arguments
2025-04-19 19:28:08,736 - INFO - Difficulty 19-20: 4 arguments
2025-04-19 19:28:08,736 - INFO - Difficulty 20-21: 6 arguments
2025-04-19 19:28:08,736 - INFO - Difficulty 21-22: 7 arguments
2025-04-19 19:28:08,736 - INFO - Difficulty 22-23: 5 arguments
2025-04-19 19:28:08,736 - INFO - Difficulty 23-24: 16 arguments
2025-04-19 19:28:08,736 - INFO - Difficulty 24-25: 8 arguments
2025-04-19 19:28:08,736 - INFO - Difficulty 25-26: 10 arguments
2025-04-19 19:28:08,736 - INFO - Difficulty 26-27: 6 arguments
2025-04-19 19:28:08,736 - INFO - Difficulty 27-28: 11 arguments
2025-04-19 19:28:08,736 - INFO - Difficulty 28-29: 4 arguments
2025-04-19 19:28:08,736 - INFO - Difficulty 29-30: 2 arguments
2025-04-19 19:28:08,736 - INFO - Difficulty 30-31: 1 arguments
2025-04-19 19:28:08,736 - INFO - Difficulty 31-32: 6 arguments
2025-04-19 19:28:08,736 - INFO - Difficulty 32-33: 5 arguments
2025-04-19 19:28:08,736 - INFO - Difficulty 33-34: 4 arguments
2025-04-19 19:28:08,736 - INFO - Difficulty 34-35: 2 arguments
2025-04-19 19:28:08,736 - INFO - Difficulty 35-36: 4 arguments
2025-04-19 19:28:08,736 - INFO - Difficulty 36-37: 3 arguments
2025-04-19 19:28:08,736 - INFO - Difficulty 37-38: 3 arguments
2025-04-19 19:28:08,736 - INFO - Difficulty 38-39: 4 arguments
2025-04-19 19:28:08,737 - INFO - Difficulty 39-40: 5 arguments
2025-04-19 19:28:08,737 - INFO - Difficulty 40-41: 7 arguments
2025-04-19 19:28:08,737 - INFO - Difficulty 41-42: 3 arguments
2025-04-19 19:28:08,737 - INFO - Difficulty 42-43: 2 arguments
2025-04-19 19:28:08,737 - INFO - Difficulty 43-44: 2 arguments
2025-04-19 19:28:08,737 - INFO - Difficulty 44-45: 4 arguments
2025-04-19 19:28:08,737 - INFO - Difficulty 45-46: 3 arguments
2025-04-19 19:28:08,737 - INFO - Difficulty 46-47: 7 arguments
2025-04-19 19:28:08,737 - INFO - Difficulty 47-48: 6 arguments
2025-04-19 19:28:08,737 - INFO - Difficulty 48-49: 2 arguments
2025-04-19 19:28:08,737 - INFO - Difficulty 49-50: 3 arguments
2025-04-19 19:28:08,737 - INFO - Difficulty 50-51: 3 arguments
2025-04-19 19:28:08,737 - INFO - Difficulty 51-52: 2 arguments
2025-04-19 19:28:08,737 - INFO - Difficulty 52-53: 1 arguments
2025-04-19 19:28:08,737 - INFO - Difficulty 53-54: 4 arguments
2025-04-19 19:28:08,737 - INFO - Difficulty 54-55: 5 arguments
2025-04-19 19:28:08,737 - INFO - Difficulty 55-56: 1 arguments
2025-04-19 19:28:08,737 - INFO - Difficulty 56-57: 6 arguments
2025-04-19 19:28:08,737 - INFO - Difficulty 58-59: 3 arguments
2025-04-19 19:28:08,737 - INFO - Difficulty 59-60: 3 arguments
2025-04-19 19:28:08,738 - INFO - Difficulty 60-61: 2 arguments
2025-04-19 19:28:08,738 - INFO - Difficulty 61-62: 5 arguments
2025-04-19 19:28:08,738 - INFO - Difficulty 62-63: 4 arguments
2025-04-19 19:28:08,738 - INFO - Difficulty 63-64: 1 arguments
2025-04-19 19:28:08,738 - INFO - Difficulty 64-65: 2 arguments
2025-04-19 19:28:08,738 - INFO - Difficulty 65-66: 2 arguments
2025-04-19 19:28:08,738 - INFO - Difficulty 66-67: 2 arguments
2025-04-19 19:28:08,738 - INFO - Difficulty 67-68: 6 arguments
2025-04-19 19:28:08,738 - INFO - Difficulty 69-70: 8 arguments
2025-04-19 19:28:08,738 - INFO - Difficulty 70-71: 7 arguments
2025-04-19 19:28:08,738 - INFO - Difficulty 71-72: 4 arguments
2025-04-19 19:28:08,738 - INFO - Difficulty 72-73: 3 arguments
2025-04-19 19:28:08,738 - INFO - Difficulty 73-74: 3 arguments
2025-04-19 19:28:08,738 - INFO - Difficulty 74-75: 3 arguments
2025-04-19 19:28:08,738 - INFO - Difficulty 75-76: 2 arguments
2025-04-19 19:28:08,738 - INFO - Difficulty 76-77: 6 arguments
2025-04-19 19:28:08,738 - INFO - Difficulty 77-78: 4 arguments
2025-04-19 19:28:08,738 - INFO - Difficulty 79-80: 2 arguments
2025-04-19 19:28:08,738 - INFO - Difficulty 80-81: 2 arguments
2025-04-19 19:28:08,739 - INFO - Difficulty 81-82: 4 arguments
2025-04-19 19:28:08,739 - INFO - Difficulty 82-83: 3 arguments
2025-04-19 19:28:08,739 - INFO - Difficulty 83-84: 2 arguments
2025-04-19 19:28:08,739 - INFO - Difficulty 84-85: 1 arguments
2025-04-19 19:28:08,739 - INFO - Difficulty 85-86: 2 arguments
2025-04-19 19:28:08,739 - INFO - Difficulty 86-87: 3 arguments
2025-04-19 19:28:08,739 - INFO - Difficulty 87-88: 4 arguments
2025-04-19 19:28:08,739 - INFO - Difficulty 90-91: 1 arguments
2025-04-19 19:28:08,739 - INFO - Difficulty 91-92: 1 arguments
2025-04-19 19:28:08,739 - INFO - Difficulty 92-93: 2 arguments
2025-04-19 19:28:08,739 - INFO - Difficulty 93-94: 2 arguments
2025-04-19 19:28:08,739 - INFO - Difficulty 95-96: 1 arguments
2025-04-19 19:28:08,739 - INFO - Difficulty 97-98: 1 arguments
2025-04-19 19:28:08,739 - INFO - Difficulty 98-99: 3 arguments
2025-04-19 19:28:08,739 - INFO - Difficulty 99-100: 2 arguments
2025-04-19 19:28:08,739 - INFO - Difficulty 102-103: 1 arguments
2025-04-19 19:28:08,739 - INFO - Difficulty 103-104: 2 arguments
2025-04-19 19:28:08,739 - INFO - Difficulty 104-105: 1 arguments
2025-04-19 19:28:08,739 - INFO - Difficulty 105-106: 2 arguments
2025-04-19 19:28:08,740 - INFO - Difficulty 106-107: 1 arguments
2025-04-19 19:28:08,740 - INFO - Difficulty 107-108: 1 arguments
2025-04-19 19:28:08,740 - INFO - Difficulty 108-109: 2 arguments
2025-04-19 19:28:08,740 - INFO - Difficulty 109-110: 2 arguments
2025-04-19 19:28:08,740 - INFO - Difficulty 110-111: 2 arguments
2025-04-19 19:28:08,740 - INFO - Difficulty 111-112: 1 arguments
2025-04-19 19:28:08,740 - INFO - Difficulty 112-113: 3 arguments
2025-04-19 19:28:08,740 - INFO - Difficulty 116-117: 1 arguments
2025-04-19 19:28:08,740 - INFO - Difficulty 117-118: 1 arguments
2025-04-19 19:28:08,740 - INFO - Difficulty 118-119: 2 arguments
2025-04-19 19:28:08,740 - INFO - Difficulty 122-123: 1 arguments
2025-04-19 19:28:08,740 - INFO - Difficulty 124-125: 1 arguments
2025-04-19 19:28:08,740 - INFO - Difficulty 125-126: 1 arguments
2025-04-19 19:28:08,740 - INFO - Difficulty 132-133: 1 arguments
2025-04-19 19:28:08,740 - INFO - Difficulty 136-137: 1 arguments
2025-04-19 19:28:08,740 - INFO - Difficulty 138-139: 1 arguments
2025-04-19 19:28:08,740 - INFO - Difficulty 146-147: 1 arguments
2025-04-19 19:28:08,740 - INFO - Difficulty 150-151: 1 arguments
2025-04-19 19:28:08,740 - INFO - Difficulty 152-153: 1 arguments
2025-04-19 19:28:08,740 - INFO - Difficulty 153-154: 1 arguments
2025-04-19 19:28:08,741 - INFO - Difficulty 154-155: 1 arguments
2025-04-19 19:28:08,741 - INFO - Difficulty 155-156: 1 arguments
2025-04-19 19:28:08,741 - INFO - Difficulty 156-157: 1 arguments
2025-04-19 19:28:08,741 - INFO - Difficulty 158-159: 2 arguments
2025-04-19 19:28:08,741 - INFO - Difficulty 160-161: 2 arguments
2025-04-19 19:28:08,741 - INFO - Difficulty 161-162: 1 arguments
2025-04-19 19:28:08,741 - INFO - Difficulty 162-163: 2 arguments
2025-04-19 19:28:08,741 - INFO - Difficulty 168-169: 1 arguments
2025-04-19 19:28:08,741 - INFO - Difficulty 171-172: 1 arguments
2025-04-19 19:28:08,741 - INFO - Difficulty 173-174: 2 arguments
2025-04-19 19:28:08,741 - INFO - Difficulty 177-178: 1 arguments
2025-04-19 19:28:08,741 - INFO - Difficulty 178-179: 2 arguments
2025-04-19 19:28:08,741 - INFO - Difficulty 180-181: 1 arguments
2025-04-19 19:28:08,741 - INFO - Difficulty 181-182: 1 arguments
2025-04-19 19:28:08,741 - INFO - Difficulty 190-191: 2 arguments
2025-04-19 19:28:08,741 - INFO - Difficulty 191-192: 1 arguments
2025-04-19 19:28:08,741 - INFO - Difficulty 192-193: 2 arguments
2025-04-19 19:28:08,741 - INFO - Difficulty 193-194: 1 arguments
2025-04-19 19:28:08,741 - INFO - Difficulty 195-196: 3 arguments
2025-04-19 19:28:08,742 - INFO - Difficulty 196-197: 1 arguments
2025-04-19 19:28:08,742 - INFO - Difficulty 198-199: 1 arguments
2025-04-19 19:28:08,742 - INFO - Difficulty 199-200: 2 arguments
2025-04-19 19:28:08,742 - INFO - Difficulty 200-201: 1 arguments
2025-04-19 19:28:08,742 - INFO - Difficulty 201-202: 1 arguments
2025-04-19 19:28:08,742 - INFO - Difficulty 203-204: 1 arguments
2025-04-19 19:28:08,742 - INFO - Difficulty 204-205: 1 arguments
2025-04-19 19:28:08,742 - INFO - Difficulty 210-211: 1 arguments
2025-04-19 19:28:08,742 - INFO - Difficulty 211-212: 1 arguments
2025-04-19 19:28:08,742 - INFO - Difficulty 216-217: 1 arguments
2025-04-19 19:28:08,742 - INFO - Difficulty 220-221: 1 arguments
2025-04-19 19:28:08,742 - INFO - Difficulty 223-224: 1 arguments
2025-04-19 19:28:08,742 - INFO - Difficulty 226-227: 1 arguments
2025-04-19 19:28:08,742 - INFO - Difficulty 227-228: 1 arguments
2025-04-19 19:28:08,742 - INFO - Difficulty 236-237: 2 arguments
2025-04-19 19:28:08,742 - INFO - Difficulty 237-238: 2 arguments
2025-04-19 19:28:08,742 - INFO - Difficulty 250-251: 1 arguments
2025-04-19 19:28:08,742 - INFO - Difficulty 251-252: 1 arguments
2025-04-19 19:28:08,742 - INFO - Difficulty 252-253: 1 arguments
2025-04-19 19:28:08,743 - INFO - Difficulty 258-259: 1 arguments
2025-04-19 19:28:08,743 - INFO - Difficulty 259-260: 1 arguments
2025-04-19 19:28:08,743 - INFO - Difficulty 262-263: 2 arguments
2025-04-19 19:28:08,743 - INFO - Difficulty 272-273: 1 arguments
2025-04-19 19:28:08,743 - INFO - Difficulty 276-277: 1 arguments
2025-04-19 19:28:08,743 - INFO - Difficulty 278-279: 1 arguments
2025-04-19 19:28:08,743 - INFO - Difficulty 279-280: 1 arguments
2025-04-19 19:28:08,743 - INFO - Difficulty 280-281: 2 arguments
2025-04-19 19:28:08,743 - INFO - Difficulty 282-283: 1 arguments
2025-04-19 19:28:08,743 - INFO - Difficulty 283-284: 1 arguments
2025-04-19 19:28:08,743 - INFO - Difficulty 284-285: 1 arguments
2025-04-19 19:28:08,743 - INFO - Difficulty 285-286: 1 arguments
2025-04-19 19:28:08,743 - INFO - Difficulty 292-293: 1 arguments
2025-04-19 19:28:08,743 - INFO - Difficulty 299-300: 1 arguments
2025-04-19 19:28:08,743 - INFO - Difficulty 303-304: 1 arguments
2025-04-19 19:28:08,743 - INFO - Difficulty 306-307: 1 arguments
2025-04-19 19:28:08,743 - INFO - Difficulty 313-314: 1 arguments
2025-04-19 19:28:08,743 - INFO - Difficulty 321-322: 1 arguments
2025-04-19 19:28:08,743 - INFO - Difficulty 323-324: 1 arguments
2025-04-19 19:28:08,743 - INFO - Difficulty 337-338: 1 arguments
2025-04-19 19:28:08,744 - INFO - Difficulty 344-345: 1 arguments
2025-04-19 19:28:08,744 - INFO - Difficulty 348-349: 1 arguments
2025-04-19 19:28:08,744 - INFO - Difficulty 357-358: 1 arguments
2025-04-19 19:28:08,744 - INFO - Difficulty 361-362: 1 arguments
2025-04-19 19:28:08,744 - INFO - Difficulty 370-371: 1 arguments
2025-04-19 19:28:08,744 - INFO - Difficulty 371-372: 1 arguments
2025-04-19 19:28:08,744 - INFO - Difficulty 391-392: 1 arguments
2025-04-19 19:28:08,744 - INFO - Difficulty 396-397: 1 arguments
2025-04-19 19:28:08,744 - INFO - Difficulty 398-399: 2 arguments
2025-04-19 19:28:08,744 - INFO - Difficulty 399-400: 3 arguments
2025-04-19 19:28:08,744 - INFO - Difficulty 400-401: 1 arguments
2025-04-19 19:28:08,744 - INFO - Difficulty 409-410: 1 arguments
2025-04-19 19:28:08,744 - INFO - Difficulty 411-412: 1 arguments
2025-04-19 19:28:08,744 - INFO - Difficulty 414-415: 1 arguments
2025-04-19 19:28:08,744 - INFO - Difficulty 415-416: 1 arguments
2025-04-19 19:28:08,744 - INFO - Difficulty 419-420: 1 arguments
2025-04-19 19:28:08,744 - INFO - Difficulty 420-421: 1 arguments
2025-04-19 19:28:08,744 - INFO - Difficulty 421-422: 1 arguments
2025-04-19 19:28:08,744 - INFO - Difficulty 426-427: 1 arguments
2025-04-19 19:28:08,745 - INFO - Difficulty 435-436: 1 arguments
2025-04-19 19:28:08,745 - INFO - Difficulty 437-438: 1 arguments
2025-04-19 19:28:08,745 - INFO - Difficulty 444-445: 1 arguments
2025-04-19 19:28:08,745 - INFO - Difficulty 455-456: 1 arguments
2025-04-19 19:28:08,745 - INFO - Difficulty 456-457: 1 arguments
2025-04-19 19:28:08,745 - INFO - Difficulty 457-458: 1 arguments
2025-04-19 19:28:08,745 - INFO - Difficulty 461-462: 1 arguments
2025-04-19 19:28:08,745 - INFO - Difficulty 462-463: 1 arguments
2025-04-19 19:28:08,745 - INFO - Difficulty 465-466: 1 arguments
2025-04-19 19:28:08,745 - INFO - Difficulty 467-468: 1 arguments
2025-04-19 19:28:08,745 - INFO - Difficulty 468-469: 1 arguments
2025-04-19 19:28:08,745 - INFO - Difficulty 469-470: 1 arguments
2025-04-19 19:28:08,745 - INFO - Difficulty 470-471: 1 arguments
2025-04-19 19:28:08,745 - INFO - Difficulty 491-492: 1 arguments
2025-04-19 19:28:08,745 - INFO - Difficulty 502-503: 2 arguments
2025-04-19 19:28:08,745 - INFO - Difficulty 513-514: 1 arguments
2025-04-19 19:28:08,745 - INFO - === End Update ===

2025-04-19 19:28:08,745 - INFO - Restarting search...
2025-04-19 20:30:23,708 - INFO - 
=== Final Summary ===
2025-04-19 20:30:23,709 - INFO - Total premises processed: 5000
2025-04-19 20:30:23,709 - INFO - Total valid arguments: 440
2025-04-19 20:30:23,709 - INFO - Total invalid arguments: 4888
2025-04-19 20:30:23,709 - INFO - Total time: 76239.08 seconds
2025-04-19 20:30:23,709 - INFO - Average time per premise: 15.25 seconds
2025-04-19 20:30:23,709 - INFO - === End Summary ===

